customer_id,customer_name,customer_email,customer_age,product_id,product_name,product_price,order_id,order_date,quantity_ordered,total_amount,review_id,review_text,review_rating
1,Gregory Stanley,adamandrews@example.net,57,841,Headphones,362.3268232196991,1,2020-07-07 23:56:36,1,362.3268232196991,1,"Huge play yeah memory.
Money hair have media others college stock. Cost focus here Republican.",3.0
2,Philip Reese,bramos@example.net,30,761,Camera,1103.689488023959,2,2020-06-14 00:02:20,4,4414.757952095836,2,Receive list ok run drop result remember state. Evidence plant better growth.,3.0
3,Michael Keller,michelletaylor@example.org,53,698,Laptop,737.0285578018337,3,2022-05-23 22:00:43,4,2948.114231207335,3,Enter never our determine beautiful car cell. Begin model occur although.,3.0
4,Christopher House,tanyawalker@example.com,63,693,Smartphone,442.5669819405781,4,2021-06-15 07:24:19,3,1327.7009458217344,4,Behind hand lose find. Because leg represent woman throw whose. Moment medical capital fear when.,1.0
5,Beth Turner,peggyramos@example.net,38,645,Laptop,1765.7049335525335,5,2021-06-26 20:21:39,3,5297.1148006576,5,,
6,Renee Hubbard,gbutler@example.net,30,482,Headphones,963.8798720998302,6,2020-10-08 23:37:48,4,3855.519488399321,6,Marriage major maintain available. Hot go price.,
7,Danielle Sanchez,gsolis@example.org,43,974,Camera,175.6706863667181,7,2021-06-26 09:30:32,4,702.6827454668723,7,,2.0
8,Dustin Suarez,randy63@example.org,30,396,Laptop,604.9881763183629,8,2022-10-11 05:00:27,2,1209.9763526367258,8,Project ability per wide. Performance choose include again indeed once.,5.0
9,Christopher Gomez,nrush@example.org,25,330,Tablet,1940.5644056877902,9,2022-06-09 05:02:53,3,5821.693217063371,9,Here field drive keep that military. Significant value for purpose.,
10,Bethany Jimenez,rnguyen@example.com,37,858,Smartphone,1675.8001587447918,10,2022-04-12 07:29:35,3,5027.400476234376,10,Cost phone none rate tree consider. Reach number court center.,3.0
11,Michael West,galvanmatthew@example.net,41,119,Smartphone,1305.5797481672641,11,2020-03-31 14:02:13,4,5222.318992669057,11,Them look she bank. Approach mean read break possible. Interest deal behavior dream prove score.,2.0
12,Joanne Martin,npierce@example.com,35,891,Laptop,104.75408575068734,12,2022-05-13 01:51:59,3,314.262257252062,12,General likely them rate continue foot.,
13,Christine Roberts,johnstoncorey@example.com,62,699,Laptop,615.6400881409234,13,2023-03-29 01:17:33,3,1846.92026442277,13,Simply dinner trial apply throw try.,5.0
14,John Bradley,williamskelsey@example.org,60,850,Tablet,1397.2867539806011,14,2021-04-26 13:49:53,1,1397.2867539806011,14,Some network mind lay court glass. Know level quality either. Pretty them that field public.,2.0
15,Edward Lloyd,qvasquez@example.com,52,115,Smartphone,824.198916704842,15,2021-12-10 07:42:18,3,2472.596750114526,15,Writer past great their why but. Pull win final pattern hour.,
16,Brandon Garcia,jeanmeyer@example.org,61,695,Headphones,1866.104184000884,16,2023-01-14 22:52:31,4,7464.416736003536,16,Deal both cost do structure message mission. Though training daughter how with kid.,2.0
17,John Johnston,laura01@example.net,52,75,Headphones,838.8609923867056,17,2022-08-02 16:27:18,4,3355.4439695468222,17,System after yet official already various along. Director college finish.,
18,Elaine Tyler,rshelton@example.net,64,548,Laptop,428.65701679758763,18,2023-04-03 17:50:42,1,428.65701679758763,18,Human we last argue week course most.,3.0
19,William Stewart,robertsmith@example.com,64,639,Camera,1084.7646404597729,19,2023-05-28 17:58:09,4,4339.058561839091,19,,
20,Julie Taylor,hmartin@example.com,49,978,Laptop,111.35017285970645,20,2022-01-13 06:44:34,2,222.7003457194129,20,Call your central former ball generation bit. Size else well fund science beautiful enough speak.,2.0
21,Cynthia Fox,jeremypark@example.net,21,993,Camera,284.6686676521829,21,2020-04-10 21:43:51,3,854.0060029565486,21,,2.0
22,Douglas Sanders,amartinez@example.org,27,63,Headphones,1235.5968371196127,22,2021-05-22 17:38:35,1,1235.5968371196127,22,Into deal finish local act music maintain. Yard best good Congress. Ten song pattern bar.,1.0
23,Christopher Jones,kjones@example.com,35,455,Camera,1360.054215077352,23,2023-04-17 15:29:12,3,4080.162645232056,23,Writer wish goal the miss. Parent possible life party government day.,3.0
24,Mark Hanson,cperry@example.org,54,929,Headphones,375.2635777153534,24,2020-07-16 01:47:48,1,375.2635777153534,24,Two brother throw community example owner. Especially machine beat gun pull feeling out will.,
25,Richard Bishop,karenflores@example.org,62,202,Tablet,723.8201004016928,25,2023-08-17 07:35:16,1,723.8201004016928,25,,3.0
26,Kevin Ramos,scottthomas@example.net,30,264,Headphones,304.56951979171845,26,2020-12-20 00:00:51,2,609.1390395834369,26,List travel strong respond able begin difficult. Success concern out be air.,3.0
27,Karen Francis,catherine19@example.org,32,352,Smartphone,964.495767918219,27,2021-03-29 08:55:17,2,1928.991535836438,27,Single car suggest agreement simple. Evidence state already apply tree cut own.,4.0
28,Melinda Smith,darius57@example.org,18,138,Camera,1216.5841050978856,28,2022-02-12 01:41:02,4,4866.336420391543,28,Cultural spend kid might. Its your theory between fall beat bad card. Dog how dinner cost itself.,1.0
29,Laura Long,perrydarrell@example.net,55,538,Laptop,756.2826472634763,29,2021-05-15 02:39:58,2,1512.5652945269526,29,,3.0
30,Christian Terry,villegasjoshua@example.org,62,325,Laptop,1009.0838828291063,30,2022-12-08 03:10:42,4,4036.335531316425,30,Scientist require authority president simply positive.,1.0
31,Donald Mcdonald,davidcoffey@example.net,61,218,Tablet,347.1531128234203,31,2021-01-13 02:42:21,1,347.1531128234203,31,,2.0
32,Eric Harvey,howarddiane@example.org,34,185,Smartphone,1257.2027438019174,32,2023-03-11 12:47:43,3,3771.608231405752,32,,
33,Billy Davis,rmooney@example.org,42,848,Camera,778.9403990389422,33,2021-11-08 20:50:53,2,1557.8807980778845,33,Check this wife seem. If medical unit discussion sister.,5.0
34,Kevin Clark,brandi26@example.org,64,720,Laptop,1716.251959159782,34,2020-10-31 08:34:38,3,5148.755877479346,34,,1.0
35,Sara Murphy,sparksjason@example.com,63,637,Camera,1472.8632095201876,35,2023-04-03 10:24:11,2,2945.7264190403753,35,Sport wish let offer rather eat. Resource culture policy take officer modern certainly lead.,4.0
36,Abigail Jones,zlee@example.net,30,966,Camera,1100.1914455984443,36,2020-03-07 17:48:08,1,1100.1914455984443,36,Local protect drop thank recently gas board. Support find test spend. Exist customer dinner beyond.,
37,Tony Alexander,stricklandthomas@example.net,41,667,Camera,1469.825990336936,37,2020-03-27 03:08:09,3,4409.477971010808,37,,1.0
38,Victor Haynes,tannermichelle@example.org,22,916,Smartphone,1333.8934506013516,38,2021-09-27 02:04:38,2,2667.786901202703,38,Campaign follow we movie after result college wind.,4.0
39,Kristin Lopez,vanessamaddox@example.net,18,506,Headphones,312.6536773352261,39,2021-11-05 20:42:29,1,312.6536773352261,39,,1.0
40,Elizabeth Watts,rallen@example.org,39,715,Tablet,1418.2346760418197,40,2021-05-17 19:32:17,4,5672.938704167279,40,Think others act tree medical. Western half sense apply reason.,2.0
41,Erin Hernandez,jefferywashington@example.org,55,161,Smartphone,685.8243061447655,41,2021-02-16 23:24:13,2,1371.648612289531,41,,3.0
42,Mrs. Tonya Stout,zimmermandonna@example.org,56,752,Laptop,1726.8948987769722,42,2020-08-24 14:00:57,1,1726.8948987769722,42,Civil impact after maybe institution responsibility would. Deal teacher expert artist.,5.0
43,Kimberly Choi,charles45@example.org,64,501,Headphones,713.5448698970376,43,2022-05-14 13:44:38,1,713.5448698970376,43,Account rather admit big adult space. Show five political change through.,3.0
44,Michael Smith,keaton@example.net,18,158,Headphones,445.65682484039405,44,2020-03-23 21:07:19,2,891.3136496807881,44,Entire lot country friend. Focus letter special song test.,5.0
45,Alexandria Nichols,manningheidi@example.net,47,321,Laptop,427.2863459267481,45,2022-08-14 14:21:02,3,1281.8590377802443,45,Safe good station hot. Exactly during easy together for add class.,4.0
46,Deborah Short,brian61@example.org,26,340,Tablet,790.8362446046949,46,2021-01-22 18:31:22,1,790.8362446046949,46,Thank start senior hospital fire. Modern real rock exactly foot training.,4.0
47,John Huynh,chavezkimberly@example.com,59,315,Headphones,558.0963785189995,47,2023-03-19 18:37:25,4,2232.385514075998,47,Lawyer not become yeah. Sense structure service occur treat. Sell could say a.,1.0
48,Elaine Wall,dustinchen@example.com,64,250,Smartphone,1870.556727374698,48,2021-07-14 06:29:24,3,5611.670182124094,48,Design whatever thus rule. Capital cell else exactly. Them tree government simply money same.,
49,Michelle Cox,christian23@example.net,27,72,Camera,1215.8456740528466,49,2021-06-10 23:16:27,1,1215.8456740528466,49,Impact deep situation person just nothing yeah.,5.0
50,Tina Rios,qwhite@example.net,46,313,Laptop,1401.7908953689998,50,2020-06-17 08:07:59,4,5607.163581475999,50,Well build their daughter. Participant carry black five where price factor.,
51,Ryan Williams,tiffany91@example.net,19,59,Camera,735.0525213010528,51,2020-12-12 15:01:48,2,1470.1050426021056,51,Usually value role difficult attention. Clearly total everyone order operation.,4.0
52,Robert Herman,holson@example.com,44,903,Laptop,1204.3324010265278,52,2021-06-20 10:52:03,3,3612.9972030795834,52,"During hundred effort lead.
Republican tax American hour. Long dog notice society.",
53,Molly Andrews,mariacarter@example.net,40,261,Camera,602.0155030659287,53,2022-03-26 06:05:08,1,602.0155030659287,53,Return able result business member. Here late realize off whose. On fear of.,4.0
54,Rachel Patel,javiersingleton@example.net,30,542,Laptop,634.0695047477468,54,2022-01-21 02:06:49,2,1268.1390094954936,54,,1.0
55,Margaret Merritt,bedwards@example.org,40,100,Tablet,1662.9608538567963,55,2023-06-27 16:22:24,1,1662.9608538567963,55,Event raise speak. Detail college hundred history ability free person water.,3.0
56,Francisco Miranda,wbaker@example.org,21,241,Tablet,429.1037532773142,56,2020-06-24 07:00:45,2,858.2075065546284,56,"Idea why woman political pay rest upon.
Maybe special simple while crime player.",3.0
57,Michael Shelton,matthew83@example.com,32,646,Laptop,1538.3208560932865,57,2020-05-11 17:12:38,3,4614.96256827986,57,Improve result set late store. Policy section evening good.,
58,Valerie Morse,sheilachavez@example.com,36,528,Camera,515.6507713968826,58,2023-06-06 07:25:34,3,1546.952314190648,58,,4.0
59,Ashley Lara,hansenerin@example.net,18,347,Laptop,1001.9334669638502,59,2020-02-24 07:40:00,4,4007.7338678554006,59,Yet fish heart scene check mouth way. Month ask financial view these able concern.,1.0
60,Nancy Miller,karen68@example.net,45,892,Camera,1268.2618455838258,60,2022-12-17 05:27:48,3,3804.7855367514776,60,Much society happy year power debate. Personal kitchen beat perform.,1.0
61,Erin Davis,thompsondavid@example.net,63,121,Camera,1470.314859273643,61,2022-04-24 18:14:45,4,5881.259437094572,61,,
62,Sarah Lopez,hramirez@example.net,46,80,Headphones,245.82388225608966,62,2021-12-25 06:46:06,2,491.6477645121793,62,Matter know at various. Student drop base true they.,2.0
63,Dwayne Caldwell,mgonzalez@example.com,28,773,Tablet,995.2630650535474,63,2023-06-10 04:49:42,1,995.2630650535474,63,Hit another decade clear foreign prevent player. Leg him figure son federal method.,5.0
64,Daniel Smith,pamela06@example.net,19,41,Headphones,751.7374207831673,64,2020-04-13 02:07:48,4,3006.949683132669,64,Again mind interesting catch buy deal. Poor every development first.,
65,Jennifer Alexander,masonbrenda@example.com,36,645,Tablet,1448.2772024455812,65,2021-10-02 18:59:53,3,4344.831607336744,65,,1.0
66,Philip Rodriguez,gilbertamanda@example.net,29,42,Camera,906.4861973688207,66,2020-05-30 11:07:14,2,1812.9723947376415,66,,4.0
67,Nicole Dillon,nicolemcdonald@example.com,52,551,Laptop,1794.5326840537634,67,2020-12-25 10:12:05,4,7178.130736215054,67,Score paper nothing read easy. Person real strategy model yard artist walk. Together nothing four.,
68,John Gomez,irobbins@example.org,22,190,Smartphone,1516.8376881618597,68,2023-04-28 17:36:43,2,3033.6753763237193,68,Letter behind push here firm team first. Forward fast church set role.,
69,Dr. Jessica Flores,charlestownsend@example.com,52,316,Tablet,1896.315583392561,69,2022-05-25 23:08:09,1,1896.315583392561,69,Throw resource cost smile how. Cost door yes memory dog.,
70,Crystal Stone,eric10@example.org,58,747,Camera,459.5512061671026,70,2023-07-11 08:43:39,1,459.5512061671026,70,Heart claim character star business operation. There after president. Strong traditional sign job.,3.0
71,Kristy Lopez,washingtonrobin@example.com,39,588,Camera,201.60251216644983,71,2023-03-08 21:32:54,4,806.4100486657993,71,Law before forget popular. Environmental myself home politics across executive final.,5.0
72,Stephanie Davis,ballkaren@example.org,28,261,Headphones,1687.8077852069932,72,2020-01-14 05:37:42,2,3375.6155704139865,72,,4.0
73,Tracy Underwood,chenmary@example.com,27,679,Smartphone,393.6725125164903,73,2021-03-16 05:31:51,2,787.3450250329806,73,,1.0
74,Marcus Walker,tcain@example.net,21,768,Laptop,563.9129638437636,74,2020-04-03 04:31:57,3,1691.7388915312908,74,Yard edge doctor out kid sell. Development serve represent cup.,5.0
75,Maria Taylor,dana82@example.net,39,794,Camera,1906.1508825776152,75,2022-11-06 21:41:06,4,7624.603530310461,75,Drive not feeling eye significant for. Seek out security production main cup thus.,3.0
76,Andrew Hays,lauradalton@example.org,49,895,Laptop,390.86412068479217,76,2021-02-16 02:53:35,1,390.86412068479217,76,On than imagine yes Mrs base. Across will especially allow.,4.0
77,Alex Allen,smithcourtney@example.org,38,662,Camera,1074.7625009726721,77,2020-07-01 09:27:54,2,2149.5250019453442,77,,
78,Mr. Thomas Harris,maria67@example.org,50,67,Camera,731.6104493533181,78,2022-05-27 14:27:01,1,731.6104493533181,78,Data then author. Show speech down article.,
79,Heather Becker,cynthiamartin@example.com,64,579,Tablet,1574.3538764047612,79,2020-05-20 13:13:45,1,1574.3538764047612,79,Remain toward already sometimes year. Surface common money worry record.,
80,April Richard,stephanie42@example.com,41,605,Smartphone,681.6275460753402,80,2020-04-16 21:35:00,2,1363.2550921506804,80,Return six star bed. Current month talk strong. Then ready wide provide reason form.,5.0
81,Rick Thompson,kaitlynbrady@example.com,53,951,Laptop,1129.0525229471907,81,2023-08-11 11:58:08,3,3387.1575688415724,81,Rise specific admit catch goal fear clear consider.,3.0
82,Carlos Gallegos,robertpotts@example.org,55,127,Laptop,737.2975789817834,82,2022-04-13 23:32:24,3,2211.8927369453504,82,Fall author final effort. Tend great peace. Ten white level idea room growth training player.,3.0
83,Ashley Espinoza,courtney77@example.org,21,503,Camera,1990.6502124348033,83,2020-11-02 12:31:59,2,3981.3004248696066,83,Officer financial second usually. Design human for to.,
84,Shawn Santos,monica75@example.com,47,952,Camera,114.57856955285777,84,2020-05-08 06:52:30,2,229.15713910571554,84,,3.0
85,Mr. Matthew Cooley,susanrobinson@example.net,48,850,Headphones,827.199672135791,85,2021-11-29 15:16:37,3,2481.5990164073733,85,Feel and body. Example bank huge.,2.0
86,Nancy Morris,pachecostephanie@example.com,56,551,Smartphone,1363.442700732334,86,2020-01-31 10:22:00,1,1363.442700732334,86,South own reason article baby. Religious machine every sense always the north compare.,
87,Robert Berry,jeffersonbob@example.com,46,236,Tablet,104.17001453918691,87,2023-05-21 10:30:14,2,208.34002907837382,87,,4.0
88,Vanessa Lawson,joemccullough@example.net,51,368,Camera,890.3348527052163,88,2021-12-05 03:44:42,1,890.3348527052163,88,Term someone community environmental industry soldier firm. Lead lay teach may cost civil yard.,1.0
89,Stephanie Todd,daniellemathews@example.net,32,200,Smartphone,245.45309619835197,89,2022-03-26 10:09:42,1,245.45309619835197,89,Lay body else appear happen. Staff behavior imagine always box rate.,5.0
90,Dylan Davis,ashley74@example.com,38,911,Tablet,946.9221939029287,90,2020-07-13 22:55:21,3,2840.7665817087864,90,Result down wear meeting wind entire source. Fact remember necessary accept rock through.,4.0
91,Lisa Garcia,wmorales@example.com,25,174,Smartphone,1554.7122297322683,91,2020-09-06 02:00:01,3,4664.136689196805,91,Fire staff way see where. Rise recently doctor true simply ten civil into.,2.0
92,Michael Stevenson,ydunn@example.net,19,653,Camera,1931.3370759164898,92,2021-05-10 07:55:26,4,7725.348303665959,92,How reality bed truth senior red. Animal may discussion step film.,3.0
93,Christopher Pollard,rvelazquez@example.net,60,698,Laptop,1180.816030348595,93,2022-01-07 23:26:37,1,1180.816030348595,93,,
94,Brian Ford,annettefoster@example.net,27,874,Headphones,465.8556650879994,94,2020-09-23 22:13:11,2,931.7113301759988,94,Avoid much blue. Reason usually artist my attention baby instead.,1.0
95,Joe Galvan,alikimberly@example.com,36,329,Camera,1348.6051225224903,95,2020-08-29 22:31:30,1,1348.6051225224903,95,Produce laugh field man interview what. Happy affect beyond rock. Chair special point success then.,
96,Angela Baker,astewart@example.com,34,275,Headphones,679.9647737997713,96,2022-06-26 19:29:48,3,2039.8943213993139,96,Build imagine wonder whom yes. Social standard professional maintain early.,5.0
97,Brian Brown,evanwagner@example.com,29,470,Laptop,601.3594288072766,97,2021-02-03 18:30:24,3,1804.0782864218297,97,,1.0
98,Megan Mendoza,susan71@example.com,24,205,Headphones,1755.3473049773613,98,2023-02-17 11:46:21,4,7021.389219909445,98,Site community school we two we kid. East simple move report. Much century raise building hear.,4.0
99,George Stark,annpatterson@example.net,59,646,Headphones,880.6128400828296,99,2020-04-12 17:40:13,1,880.6128400828296,99,,4.0
100,Michael Moore,kathleenroach@example.net,64,892,Headphones,822.1677091262198,100,2022-10-12 10:08:03,4,3288.6708365048794,100,,2.0
101,Timothy Mejia,kimberlysnyder@example.net,35,908,Camera,1554.321401321355,101,2022-11-13 06:34:52,3,4662.964203964066,101,Major responsibility lose whether suddenly seven task.,
102,Laura Moreno,nguyenmichael@example.com,22,898,Headphones,1283.134479798192,102,2022-07-24 08:55:41,3,3849.403439394576,102,,4.0
103,Mariah Smith,jasmineford@example.com,40,69,Headphones,894.5032443508073,103,2020-09-05 12:48:28,3,2683.5097330524222,103,Pm on expert everything. Board lawyer fish have apply.,5.0
104,Kerry Taylor,ugriffin@example.net,63,428,Headphones,1883.169659349706,104,2020-06-01 10:24:05,4,7532.678637398824,104,Purpose ground night. Race bill among phone star dark.,3.0
105,John Simpson,gwong@example.org,42,85,Smartphone,1999.8280298887112,105,2021-12-13 20:45:14,3,5999.4840896661335,105,"Play could shoulder improve expect.
Computer Mrs heart author. Character than who threat.",4.0
106,James Mcclure,barnesjillian@example.com,49,940,Smartphone,1658.283769545223,106,2021-01-28 12:07:33,3,4974.851308635669,106,Strong body whole culture all dog. Rate value social watch election. Ten here similar maybe bill.,
107,Kelsey Gibbs,psanchez@example.net,18,480,Laptop,1138.1315136872258,107,2021-10-06 21:48:06,2,2276.2630273744517,107,Standard he behavior recently all. Like success research third continue very.,2.0
108,Megan Dean,arnoldjames@example.com,22,644,Camera,1480.7398431704935,108,2022-07-05 09:27:06,4,5922.959372681974,108,Attorney produce security prepare maybe now. Cost follow green actually.,2.0
109,Anthony Wood,darryljimenez@example.net,43,348,Tablet,440.6998804846463,109,2020-01-15 07:24:32,4,1762.7995219385853,109,Impact just specific sister rest season.,
110,Steven Charles,kimberlyharris@example.net,34,809,Tablet,489.4518673362521,110,2022-07-12 11:13:22,3,1468.3556020087563,110,,
111,Stephen Bentley,pjackson@example.org,53,346,Headphones,324.8489990765147,111,2022-02-14 21:07:38,3,974.5469972295441,111,,1.0
112,Frederick Newman,carolwilliams@example.org,61,246,Camera,1198.6809573234252,112,2020-02-04 09:18:00,3,3596.042871970276,112,Memory ahead water kid call. House month tend past impact. Information eight third low.,4.0
113,Abigail Johnson,hcarson@example.net,59,85,Tablet,1337.2808919834115,113,2021-04-11 19:15:01,4,5349.123567933646,113,Night executive picture recognize compare possible top. Spend computer debate both.,4.0
114,Elizabeth Nelson,kdelgado@example.net,24,667,Headphones,1801.9837139907502,114,2022-06-29 19:56:31,4,7207.934855963001,114,Trip dog cut. Such student evening parent. Purpose why human open effort suggest all.,2.0
115,Kayla Hunter,cody69@example.org,60,763,Smartphone,1759.8308994452323,115,2021-08-09 05:47:02,3,5279.492698335696,115,,3.0
116,Dorothy Phillips,moraleschristine@example.com,24,611,Laptop,1746.1619118303774,116,2021-11-20 07:12:58,3,5238.485735491133,116,,1.0
117,Bruce Davis,cruzshawn@example.org,24,424,Headphones,1415.7314053539967,117,2022-12-22 13:00:14,2,2831.4628107079934,117,Have choice sister never after source. News war on.,4.0
118,Francisco Warren,davismichael@example.com,62,145,Smartphone,1749.075401468867,118,2023-06-09 01:10:38,2,3498.150802937734,118,Herself stuff but small speech. Force item style. Part risk enough.,
119,Elizabeth Russell,thomasbrandy@example.com,33,223,Headphones,759.8980144011808,119,2020-01-11 17:04:43,1,759.8980144011808,119,On health commercial yes let growth among. Rich peace president speech open court trial.,
120,Michael Cruz,nmarshall@example.net,20,566,Headphones,1656.094205417916,120,2021-01-18 10:58:12,3,4968.2826162537485,120,Month run why buy per religious. Never player stand team area per set. Him soon market paper.,5.0
121,Rickey Huber,christopher06@example.com,41,523,Smartphone,193.55649464348886,121,2020-10-16 19:06:39,3,580.6694839304666,121,,4.0
122,Laura Jefferson,christianbrown@example.org,21,908,Smartphone,629.9550154508439,122,2022-05-08 08:25:33,4,2519.8200618033757,122,Article sure simply man significant test four.,4.0
123,Felicia Kelley,jonathan68@example.com,54,213,Laptop,1442.9773855992225,123,2020-09-06 08:33:53,1,1442.9773855992225,123,,3.0
124,Rebecca Snyder,dawnfarley@example.com,28,61,Tablet,1698.6589150170428,124,2021-10-23 14:03:40,4,6794.635660068171,124,Suggest people meeting fine. Material tonight nor write.,5.0
125,James Ford,fvasquez@example.com,54,644,Smartphone,383.9282278255758,125,2021-05-07 09:06:36,3,1151.7846834767274,125,He live purpose control Mrs way young.,3.0
126,Erika Stein,gomezsherry@example.net,55,894,Headphones,1992.7938818250204,126,2023-01-20 22:25:19,3,5978.381645475061,126,Type sing particularly interest thank treatment. Us it treat. Something thing month laugh tough.,1.0
127,Thomas Williamson,cheyennebrown@example.org,62,857,Camera,1400.792377671187,127,2023-05-02 03:59:46,1,1400.792377671187,127,Nation business nor religious.,5.0
128,Melissa Jackson DVM,jessica12@example.net,60,698,Tablet,577.0825751101167,128,2020-07-30 20:30:02,2,1154.1651502202335,128,,1.0
129,Danielle Lewis,wjohnson@example.com,48,543,Laptop,1242.822202004296,129,2021-05-29 00:56:21,3,3728.4666060128884,129,,3.0
130,Mary Hood,qfry@example.net,21,992,Headphones,1911.430591879942,130,2020-10-05 02:08:18,3,5734.2917756398265,130,,
131,Cassandra Murphy,jcaldwell@example.com,48,141,Laptop,998.257164200156,131,2022-04-11 07:01:31,1,998.257164200156,131,Determine happy relate ability.,2.0
132,Lori Gomez,isabella69@example.net,56,20,Headphones,921.4289733478597,132,2021-10-08 03:54:38,2,1842.8579466957194,132,"It consider something each later water song.
Point serious car recently job be.",1.0
133,Brandi King,stevenjohnson@example.net,22,671,Tablet,684.5191707502028,133,2023-01-14 03:16:34,4,2738.076683000811,133,,2.0
134,Molly Nicholson,stonekimberly@example.com,59,449,Smartphone,1204.3346453878319,134,2022-04-21 19:32:36,4,4817.3385815513275,134,,
135,Wendy Wood,petermartin@example.com,24,275,Tablet,1829.129467514773,135,2021-01-27 02:47:27,3,5487.388402544319,135,Fund product our any also think allow particularly.,2.0
136,Brandon Fields,royparker@example.net,38,706,Headphones,1295.0169783790254,136,2021-07-17 08:21:19,2,2590.033956758051,136,Give campaign list relate tend allow. Nice turn four operation white share.,2.0
137,Jaime Harris,blake31@example.org,33,122,Tablet,1915.3720766830527,137,2020-07-05 21:05:21,2,3830.7441533661054,137,Husband course issue note garden pretty. Step kid difficult animal.,2.0
138,Ryan Dillon,martinrenee@example.org,44,982,Headphones,531.300168347567,138,2022-11-03 23:47:29,2,1062.600336695134,138,,1.0
139,David Taylor,oberg@example.net,19,873,Laptop,1958.7383573241257,139,2022-03-19 05:55:55,3,5876.215071972377,139,,4.0
140,Natalie Garcia,esimmons@example.com,19,511,Smartphone,413.6098472857626,140,2021-07-27 18:39:57,2,827.2196945715252,140,Image there accept design authority. Involve there interview.,5.0
141,Donald Robles,jessicalamb@example.org,32,699,Tablet,1847.6293140222126,141,2023-04-26 18:32:35,3,5542.887942066638,141,Scene city recently relationship white. Car financial activity series personal travel.,
142,Nicholas Dixon,deannagonzalez@example.net,51,545,Camera,855.9623304324605,142,2020-09-10 06:08:42,3,2567.8869912973814,142,Than campaign know night. Meet successful fill quickly.,5.0
143,Patrick Wade,erikadams@example.org,39,751,Headphones,1992.7914563203815,143,2021-07-06 08:03:33,2,3985.582912640763,143,Rise space such to player. Interesting challenge involve again those.,5.0
144,Pamela Mendez,wanda38@example.org,34,174,Headphones,1703.208857455363,144,2023-04-10 21:09:49,1,1703.208857455363,144,,3.0
