customer_id,customer_name,customer_email,customer_age,product_id,product_name,product_price,order_id,order_date,quantity_ordered,total_amount,review_id,review_text,review_rating
286,James Crawford,richard75@example.net,53,816,Smartphone,1704.1259883958446,286,2020-07-06 05:18:04,2,3408.2519767916892,286,,
287,Robert Cox,marybutler@example.org,53,654,Laptop,1243.9297022405576,287,2020-02-25 12:29:57,2,2487.8594044811152,287,,3.0
288,Nathaniel Brown,andrewmay@example.org,52,891,Camera,336.3195720957195,288,2022-07-26 10:29:32,4,1345.278288382878,288,Executive us deep. Cell man almost strong Republican thousand capital wonder.,
289,Debra Guerrero,duarteheidi@example.org,52,252,Laptop,420.97043368657995,289,2020-02-10 20:04:00,2,841.9408673731599,289,Although several light executive. Base brother ahead authority our record measure never.,3.0
290,Corey Harmon,bellmark@example.org,50,68,Tablet,1975.5096424661344,290,2020-06-27 11:53:52,1,1975.5096424661344,290,Room official necessary week avoid. Artist top usually machine. Trial defense short hotel.,3.0
291,Daniel Anderson,colemclean@example.com,31,270,Camera,754.0143632087605,291,2021-09-18 03:15:11,3,2262.0430896262815,291,Compare station unit. Help morning partner visit really.,4.0
292,George Sutton,ruthkim@example.com,35,985,Laptop,1788.1448806674246,292,2023-02-05 18:39:58,3,5364.434642002274,292,,
293,Jasmine Holland,donald07@example.net,30,299,Headphones,1011.4264754037149,293,2022-11-26 17:43:33,1,1011.4264754037149,293,Traditional seven structure nature near. My worker end build eye present day.,
294,Darius Leblanc,mstewart@example.com,36,840,Tablet,1549.6555462733047,294,2021-05-13 21:34:44,4,6198.622185093219,294,Job them particular lawyer investment author. Debate professional individual.,2.0
295,Emily Smith,ningram@example.net,29,270,Tablet,872.10703091913,295,2021-05-26 06:35:46,4,3488.42812367652,295,,4.0
296,Abigail Alvarez,betty47@example.org,43,159,Smartphone,557.767912667426,296,2023-04-26 17:09:50,4,2231.071650669704,296,Various six everything face see politics popular. Continue necessary yet.,5.0
297,Michelle Bell,kristen16@example.org,48,322,Laptop,924.8613033138805,297,2022-01-15 09:38:01,3,2774.5839099416417,297,Without huge always democratic land ahead cup.,1.0
298,Charles Hendrix,macdonaldjennifer@example.org,19,615,Tablet,944.8958582170102,298,2021-11-03 07:42:05,4,3779.5834328680407,298,Interview position near thank. Case contain most health owner radio.,
299,Johnny Skinner,lindsay71@example.net,18,505,Laptop,668.1549003853472,299,2022-05-14 18:00:42,2,1336.3098007706944,299,Contain chair accept yard among wind half group.,5.0
300,Patricia Hall,linda74@example.net,42,121,Camera,135.76900659946335,300,2022-09-04 07:01:12,1,135.76900659946335,300,,
301,Cindy Valdez,ialexander@example.com,59,485,Camera,1867.238072701432,301,2022-12-04 23:33:30,4,7468.952290805728,301,,3.0
302,Jeffrey Mccarty,hoganmargaret@example.net,24,337,Smartphone,219.84168502395696,302,2022-01-07 16:13:53,3,659.5250550718708,302,Bag character science guy despite. Administration financial live six.,1.0
303,Jennifer Hunt,ralph76@example.org,27,454,Camera,1266.045093319299,303,2020-02-27 22:54:02,4,5064.180373277196,303,,3.0
304,Joshua Flowers,benjaminleroy@example.com,46,91,Smartphone,1447.583328691469,304,2022-07-26 03:34:38,1,1447.583328691469,304,Truth heart father. Teach range night law he billion her truth. Outside character security economy.,5.0
305,Joshua Willis,kellyshannon@example.org,61,491,Laptop,1431.9552236475913,305,2020-12-14 08:38:29,1,1431.9552236475913,305,"Best push peace feel.
Those opportunity enjoy adult carry operation them. Must discover guy sure.",
306,Timothy Thompson,antonio44@example.org,50,303,Laptop,1246.532521245748,306,2020-05-18 08:00:28,3,3739.597563737244,306,Hair call six huge. Bad bring may.,4.0
307,Lynn Jones,robertsoncheryl@example.com,19,950,Laptop,1466.4886078071988,307,2020-06-29 18:30:14,4,5865.954431228795,307,Public heart cost guy political away. Cell store billion fast military.,1.0
308,Dawn Snyder,perezseth@example.net,49,359,Tablet,485.996955590192,308,2021-01-14 21:39:12,4,1943.987822360768,308,,
309,Cheryl Cameron,yhorn@example.net,30,772,Tablet,833.5473191477278,309,2021-10-30 06:24:00,1,833.5473191477278,309,,
310,Toni Cantu,martinezhector@example.com,31,458,Camera,581.8237055030459,310,2022-06-15 19:53:40,3,1745.4711165091376,310,,4.0
311,Randy Colon,broberts@example.net,33,532,Tablet,957.3120039162285,311,2020-03-11 22:46:07,4,3829.248015664914,311,,1.0
312,Martin Hunt,jamesgomez@example.com,28,209,Camera,1933.1029563782624,312,2021-11-09 20:06:20,4,7732.41182551305,312,Off control able public military. Resource center everything add surface better talk.,4.0
313,Stephanie Anderson,nicole63@example.com,41,469,Camera,649.2959423104966,313,2022-06-19 09:52:33,1,649.2959423104966,313,Relate upon TV range increase plan.,2.0
314,Marissa Perkins,jamespearson@example.com,54,268,Smartphone,202.78579945583607,314,2022-11-01 09:48:58,1,202.78579945583607,314,Writer very order heavy. Free option beautiful us themselves base.,
315,Hannah Miller,twiggins@example.net,46,933,Tablet,170.0018442027183,315,2022-06-09 02:55:13,2,340.0036884054366,315,,5.0
316,Adriana Cervantes,barnesrebecca@example.com,55,709,Tablet,1245.5951656536604,316,2021-12-11 14:17:36,4,4982.380662614642,316,,4.0
317,Bonnie Ochoa,adam80@example.net,62,251,Camera,845.234418196626,317,2021-02-22 19:46:04,1,845.234418196626,317,With change stay. Entire last my. Billion forward health guess none.,1.0
318,Brian Nelson,tyler74@example.com,20,26,Laptop,1678.72575429337,318,2023-09-15 06:07:45,1,1678.72575429337,318,Movie amount enjoy newspaper leader wear eye rather. Body easy coach. Suddenly if race interest.,3.0
319,Tonya Wallace,ericabennett@example.org,30,264,Tablet,389.7910701239619,319,2022-08-02 00:07:50,3,1169.3732103718858,319,International wife million radio. Sport defense management.,5.0
320,Brittany Combs,doconnell@example.org,24,862,Tablet,1467.8794417422505,320,2023-09-18 07:32:23,4,5871.517766969002,320,,2.0
321,David Osborn,phensley@example.org,51,104,Tablet,1455.4820728059929,321,2023-02-03 14:40:00,4,5821.928291223971,321,,3.0
322,Craig Payne DDS,williamsmelissa@example.net,31,478,Smartphone,1514.0197640126992,322,2023-06-21 11:04:13,3,4542.059292038098,322,,1.0
323,Brooke Jones,melissa03@example.org,62,94,Camera,1604.359408633482,323,2023-08-19 21:44:03,1,1604.359408633482,323,,5.0
324,Jessica Alvarez,mcdonaldsarah@example.org,39,994,Camera,1428.7382382075436,324,2022-02-11 09:07:25,2,2857.4764764150873,324,,3.0
325,John Brown,elizabethallen@example.com,35,10,Tablet,1787.0605485531983,325,2020-01-01 09:13:34,1,1787.0605485531983,325,Detail future build crime. Note end finally change business.,2.0
326,Mrs. Abigail Lynn,mary33@example.org,29,934,Laptop,1059.931845953843,326,2021-11-01 19:00:03,3,3179.7955378615293,326,,
327,John Harper,fosterandrew@example.org,33,64,Smartphone,1102.5139948771566,327,2023-03-28 10:26:44,3,3307.54198463147,327,Film reason western area explain.,2.0
328,Christopher Hernandez,john19@example.com,36,11,Tablet,443.7858010210721,328,2022-01-22 21:15:56,4,1775.1432040842883,328,,4.0
329,Debbie Gomez,carrie37@example.org,59,109,Laptop,1330.9013500509955,329,2022-01-09 20:08:30,4,5323.605400203982,329,,
330,Tim English,dylanschultz@example.net,52,813,Tablet,1967.6107377541623,330,2020-07-16 19:04:28,2,3935.2214755083246,330,,3.0
331,Richard Romero,thompsonronald@example.net,50,213,Camera,782.5688280205787,331,2021-10-26 03:36:05,1,782.5688280205787,331,,
332,Benjamin Moses,bryanbond@example.org,46,800,Camera,739.4648864075355,332,2023-02-26 07:00:39,3,2218.3946592226066,332,Color believe reality this. Still if thought old.,5.0
333,Kelsey White,ashley01@example.org,26,290,Laptop,1841.323713735524,333,2023-08-28 05:49:25,4,7365.294854942096,333,,4.0
334,Ryan Atkins,lisa82@example.org,24,824,Headphones,1556.4830340916799,334,2021-02-22 19:30:20,4,6225.9321363667195,334,Middle force skill this possible value. Financial claim either field. Laugh war still hundred.,2.0
335,Christopher Garner,oelliott@example.net,64,733,Tablet,1852.3531419303479,335,2021-05-04 17:17:33,3,5557.059425791043,335,,
336,Dylan Patton,shopkins@example.org,18,547,Headphones,190.12357942700461,336,2023-06-02 18:11:50,4,760.4943177080185,336,,4.0
337,Jeffrey Moon,sanchezkayla@example.org,52,110,Headphones,1595.3811680529977,337,2023-07-26 22:32:14,1,1595.3811680529977,337,Former early couple sometimes. Music worry will actually middle.,
338,David Russell,qlang@example.com,62,379,Laptop,1618.1462303815533,338,2022-10-27 11:21:01,2,3236.2924607631066,338,,
339,Shannon Bowen,valdezkelly@example.org,56,199,Tablet,1185.818650940039,339,2020-06-03 11:28:41,1,1185.818650940039,339,Walk year near money peace. Simple book remain to girl. Mention skill dinner expert religious.,
340,Kayla Garcia,greed@example.net,32,652,Tablet,761.2823773894388,340,2020-12-06 12:14:47,1,761.2823773894388,340,Particular moment very action kitchen. Put central environment PM child relate will.,
341,Traci Warren,amy58@example.net,31,960,Headphones,1334.1828063415849,341,2020-06-19 22:19:20,3,4002.5484190247544,341,,1.0
342,Crystal Castillo,melissa57@example.net,60,814,Laptop,1975.7706579478368,342,2021-12-12 03:27:45,1,1975.7706579478368,342,Plant test senior case cost. Matter effect knowledge newspaper accept quite small.,3.0
343,Andrea Maddox,brownmary@example.net,60,3,Laptop,1970.7908891224497,343,2023-03-03 09:22:58,2,3941.5817782448994,343,"Or play official believe ready. Door skin clearly argue.
Team term address threat.",
344,Lauren Anderson,ashlee25@example.org,40,993,Laptop,535.1363873144522,344,2020-10-28 22:42:58,3,1605.4091619433566,344,First box red police. Space final prove adult movie require wrong. Arm it use college.,
345,Renee Ross,murphymonica@example.org,47,343,Headphones,891.0809165540763,345,2023-05-01 19:21:49,1,891.0809165540763,345,Many and sign thousand. Buy born require doctor bad course property.,
346,Mark Fischer,nicholasgrant@example.net,42,345,Headphones,1536.5455208962373,346,2023-07-19 16:14:10,2,3073.0910417924747,346,,
347,Austin Mason,awang@example.com,51,525,Smartphone,1314.4424113319167,347,2021-09-30 21:37:51,2,2628.8848226638333,347,,3.0
348,Thomas Santiago,morganangela@example.net,52,773,Laptop,1957.4038206383677,348,2021-09-15 10:18:33,2,3914.8076412767355,348,Turn tax way significant store. Want it same begin.,1.0
349,Virginia Stevens,sarah97@example.net,50,886,Laptop,1691.1090863363056,349,2022-04-24 10:21:47,1,1691.1090863363056,349,"Most research door specific sense response. Degree seven something note.
Go chair mean open seek.",
350,Timothy Jones,jamesmay@example.org,23,657,Tablet,1930.4573689052258,350,2020-05-12 02:47:31,1,1930.4573689052258,350,Drive as whatever she few order top. Skill process stand realize.,
351,Joy Owens,eglass@example.net,49,481,Camera,1855.0140702607866,351,2021-10-17 14:17:03,2,3710.0281405215733,351,,4.0
352,Caitlin Taylor,pburton@example.org,36,203,Smartphone,807.6956765256862,352,2021-01-30 22:08:26,1,807.6956765256862,352,Star wide move. Age analysis machine newspaper late.,5.0
353,Tiffany White,alejandrokrause@example.com,62,874,Smartphone,577.6194755254824,353,2023-06-02 21:47:24,3,1732.858426576447,353,,4.0
354,Mark Brown,pcampbell@example.org,61,158,Laptop,376.13393729175914,354,2021-04-19 12:34:35,4,1504.5357491670366,354,"However since east my hot order expect.
Idea along kitchen thus show. By form part coach.",
355,Jason White,yadams@example.net,41,123,Headphones,197.16966121106728,355,2020-07-30 05:03:29,4,788.6786448442691,355,,5.0
356,Heather Gray,grosario@example.net,61,116,Camera,915.2446630685814,356,2022-08-14 17:20:09,4,3660.9786522743257,356,Daughter behind central support prepare similar practice meeting. Mind room here style coach paper.,
357,Cody Baldwin,christinasherman@example.net,55,235,Smartphone,1984.943503079064,357,2022-09-12 05:32:44,1,1984.943503079064,357,,4.0
358,Ashley Vasquez,salinassean@example.net,46,248,Smartphone,1194.2950748233777,358,2020-04-27 23:56:55,3,3582.885224470133,358,Another head explain family fact year very alone. Bill personal machine lawyer social hit.,
359,Jessica Martin,selenablake@example.org,64,688,Laptop,1560.8541704145352,359,2023-07-18 23:16:03,2,3121.7083408290705,359,Not model marriage buy system no. Somebody employee share form prepare.,
360,Robert Green,pauljensen@example.com,58,780,Headphones,380.50299988248594,360,2020-04-21 12:53:03,2,761.0059997649719,360,Hospital long effort any. Hear debate war seven.,4.0
361,Katrina Spencer,browntammy@example.net,40,204,Camera,676.2575260538051,361,2022-04-12 20:52:37,4,2705.0301042152205,361,,
362,Dana Booth,carrwilliam@example.org,38,520,Tablet,1188.3709833921523,362,2022-04-25 22:19:43,4,4753.483933568609,362,Civil skin carry person yes. Summer cold show side whose. Serve everything machine political.,3.0
363,Billy Tucker,patriciabryant@example.net,26,48,Smartphone,1265.8772566333926,363,2020-12-23 10:25:49,4,5063.50902653357,363,Recognize former suddenly central. Surface worry toward old plant get up.,4.0
364,Rodney Cruz,kendrasloan@example.com,20,958,Tablet,429.75491486601015,364,2023-07-04 06:00:46,3,1289.2647445980306,364,"Bank similar sure start.
You local again to. Talk despite what everything church work key.",5.0
365,David Hunter,zperry@example.net,61,478,Camera,1301.3869049932491,365,2023-05-14 14:07:57,4,5205.5476199729965,365,North keep trouble participant.,5.0
366,Kelly Rogers,nfowler@example.net,45,298,Headphones,373.0746918081608,366,2020-10-21 21:25:45,1,373.0746918081608,366,Teacher page ever learn nor. Color Mrs election magazine as billion bag west.,2.0
367,Samuel Maynard,vvargas@example.net,64,270,Camera,1457.567845227391,367,2023-01-02 05:44:33,2,2915.135690454782,367,During early friend record reduce if. Production wife federal. Head center window.,
368,Andrew Stewart,xcooper@example.net,48,868,Tablet,1900.6408393931013,368,2022-07-14 01:22:29,3,5701.922518179304,368,,5.0
369,Rebecca Mccoy,amcdaniel@example.org,55,359,Camera,616.7521115217928,369,2020-11-17 09:45:19,1,616.7521115217928,369,True campaign control likely source appear.,
370,Ian Taylor,josephnorris@example.org,45,428,Headphones,890.5901257008419,370,2021-01-16 03:55:05,2,1781.1802514016838,370,,1.0
371,David Jordan,sreed@example.org,29,834,Headphones,687.516314200776,371,2021-03-06 06:42:10,4,2750.065256803104,371,Particularly same series remain pull system again. Show identify certainly.,3.0
372,Douglas Fletcher,teresa56@example.org,37,448,Camera,774.6753809830789,372,2022-03-19 17:48:37,1,774.6753809830789,372,,3.0
373,Michael Robinson MD,obrienbethany@example.com,19,66,Laptop,563.1211329442058,373,2023-04-05 00:14:40,2,1126.2422658884116,373,,
374,Michael Taylor,emiller@example.net,39,631,Tablet,1357.7791593414292,374,2020-12-12 00:23:14,3,4073.3374780242875,374,Major effect first matter. Soldier president eye deep author note sport chair.,5.0
375,Brian Bates,danielsgregory@example.org,36,602,Smartphone,688.911499377451,375,2020-11-29 22:08:28,1,688.911499377451,375,"Painting three culture drive early.
Analysis example might which happen clearly.",
376,Marco Maxwell,lewiscarolyn@example.net,31,543,Headphones,1226.2294231573162,376,2022-10-11 01:22:56,1,1226.2294231573162,376,White just group cultural nature entire.,
377,Michael Williams,megan95@example.com,30,238,Headphones,199.27290088260446,377,2022-04-27 09:51:36,1,199.27290088260446,377,Almost your personal when. Even likely resource already whom.,5.0
378,Crystal Madden,kelliwilson@example.net,31,301,Tablet,1279.335677386769,378,2022-09-11 13:59:19,4,5117.342709547076,378,His consumer seek wind dark. Someone science whom its that just officer.,3.0
379,Fernando Aguirre,ramirezjohn@example.net,39,233,Camera,1140.4290592516634,379,2021-09-14 01:13:22,1,1140.4290592516634,379,Prove mean evidence environment store rate development.,1.0
380,Charles Thomas,hmercer@example.org,63,328,Tablet,300.7379091532764,380,2021-06-23 20:25:32,4,1202.9516366131056,380,,2.0
381,Timothy Chambers,cheryl24@example.com,46,541,Smartphone,328.8922078804,381,2021-06-20 00:33:40,2,657.7844157608,381,,5.0
382,Julie Adams,samanthabell@example.com,54,693,Tablet,1497.741270540573,382,2020-03-23 19:54:23,2,2995.482541081146,382,Field account suggest perhaps body American.,5.0
383,Luis Scott,ronaldfoster@example.org,31,921,Tablet,330.4321355281504,383,2023-03-24 22:23:28,3,991.2964065844512,383,Civil gun news must budget government. Only skin east. American quite whole may.,
384,Christopher Riggs,leroy65@example.org,49,64,Smartphone,1980.6654397420748,384,2022-03-01 22:30:14,1,1980.6654397420748,384,Practice fire argue stage form across.,5.0
385,Kristi Greene,fgarcia@example.org,57,357,Laptop,108.82678012365972,385,2022-03-01 18:18:40,2,217.65356024731943,385,Skin allow whatever green model. Less lay look.,1.0
386,Cathy Hunter,marvinalvarez@example.net,53,825,Tablet,936.5898251072068,386,2021-07-01 05:34:42,3,2809.7694753216206,386,Almost election instead or interest. Some five work national he.,5.0
387,Melinda Meyer,reedbrandy@example.org,46,426,Smartphone,1858.288513088696,387,2022-08-23 21:03:23,1,1858.288513088696,387,Surface hour white town history get remain. Story player four new. Far hear security.,2.0
388,Jessica Alexander,tammymiller@example.com,43,443,Smartphone,1484.878950350577,388,2023-02-01 16:16:17,1,1484.878950350577,388,Nothing approach same section certain before. Mind adult statement article. Buy cause size.,
389,Stacey Fuentes,joneskristina@example.com,60,76,Tablet,1218.51644978981,389,2022-01-03 22:09:50,1,1218.51644978981,389,,1.0
390,Brandy Johnston,whayes@example.com,52,600,Smartphone,420.12785280896424,390,2020-11-17 06:38:04,1,420.12785280896424,390,Have over employee between four participant. North alone nature clear effort have.,5.0
391,Ashley Santos,brianna55@example.org,62,177,Headphones,1488.566766823049,391,2021-10-25 17:33:21,3,4465.700300469147,391,,3.0
392,Brittany Lee,shane80@example.net,44,955,Smartphone,1873.0694491440431,392,2023-02-26 02:43:19,3,5619.20834743213,392,Join station simple protect those. Almost seem avoid thus base list.,4.0
393,Dr. Michael Buck,sandra04@example.org,32,214,Laptop,855.810858424776,393,2020-09-03 18:59:42,1,855.810858424776,393,Onto fire money edge law. Real tell still action cover must.,1.0
394,Melanie Smith,curtisfoley@example.net,58,870,Tablet,772.6757159843283,394,2021-07-15 23:53:13,1,772.6757159843283,394,Story group design soldier.,2.0
395,Courtney Lee,ramoscameron@example.org,38,130,Headphones,1847.9344101818242,395,2021-03-28 11:12:00,4,7391.737640727297,395,Cut stuff natural improve add already. Another run product number.,4.0
396,Kenneth Ward,acox@example.net,53,137,Camera,354.15865611062316,396,2022-04-24 20:52:16,2,708.3173122212463,396,Then price game record parent. Board place prepare.,3.0
397,Tammy White,ilopez@example.com,63,835,Smartphone,1096.4967334724483,397,2022-09-17 10:38:04,2,2192.9934669448967,397,Soon order all around bit fill under article. Staff image record there federal consumer college.,3.0
398,Mr. James Fischer,kellyshelley@example.org,42,479,Tablet,968.0205834891495,398,2021-12-29 11:05:12,3,2904.0617504674487,398,Economic note point without attorney art affect grow. Some state list.,
399,Alyssa Curry,michaelarnold@example.org,19,197,Headphones,1302.4604912564,399,2022-08-20 03:38:25,2,2604.9209825128,399,"Beautiful interesting later do thank analysis state.
Total half wonder into trouble.",3.0
400,Anthony Williams,brownjasmine@example.net,51,137,Laptop,788.7889499625815,400,2023-04-21 14:08:49,3,2366.366849887744,400,Simple natural method material step. Where affect evidence environment. Chair loss experience than.,
401,Hayden Duke,steven24@example.org,32,807,Tablet,320.9218852194349,401,2021-02-18 14:14:12,1,320.9218852194349,401,Number hot recognize think. Sport huge it.,3.0
402,Jennifer Robertson,charles67@example.com,50,273,Camera,816.6123406675067,402,2023-08-06 04:31:37,1,816.6123406675067,402,Possible usually certain sport laugh class tonight senior. Hair nice most different really class.,1.0
403,James Green,caleb23@example.net,26,282,Camera,1687.6442555164626,403,2022-07-16 11:37:34,1,1687.6442555164626,403,Also growth window have. Level church sport cause down. Include happy or senior movie.,4.0
404,Karen Brown,hardytara@example.net,35,798,Camera,1926.7670585727237,404,2022-10-13 23:26:09,1,1926.7670585727237,404,,4.0
405,Alexander Reyes,cynthiajenkins@example.com,27,217,Tablet,238.77566849855637,405,2023-08-25 22:32:24,2,477.55133699711274,405,,1.0
406,Chad Williams,jensenrhonda@example.net,33,195,Smartphone,1750.9160402480825,406,2023-06-15 12:45:03,2,3501.832080496165,406,Picture human beat middle order long. Performance clear budget we Republican product network.,4.0
407,Bruce Jones,obrown@example.net,59,187,Laptop,1006.2110009993257,407,2020-01-01 09:18:21,1,1006.2110009993257,407,Herself about where economy window. Explain wish born room small adult.,
408,Allison Fernandez DDS,brianthornton@example.net,64,792,Headphones,1594.2527214611923,408,2021-10-20 14:00:48,3,4782.7581643835765,408,"Hope manage peace present dog billion. Foreign reflect indicate issue.
Thus low factor individual.",2.0
409,Anthony Watson,stevenstodd@example.net,48,828,Smartphone,1514.9510592217869,409,2020-10-21 09:00:30,2,3029.9021184435737,409,Late read four. From road off beat garden.,
410,Grant Evans,melanie44@example.org,53,408,Tablet,182.68150610639543,410,2020-07-06 16:55:04,3,548.0445183191863,410,Kid product none. Hard then one list physical during. Professor away recognize.,
411,Jacqueline Huerta,chad10@example.com,50,961,Tablet,130.77292494617444,411,2021-03-01 19:15:40,2,261.5458498923489,411,,
412,Anthony Moore,brittney96@example.org,40,597,Headphones,908.0797917162561,412,2022-04-18 15:11:43,2,1816.1595834325121,412,,2.0
413,Nicole Brown,erin13@example.org,22,749,Headphones,1414.0272667171068,413,2022-02-28 16:19:25,2,2828.0545334342137,413,Congress cell safe cover test. Director my field. Bring theory whole tree issue forward.,5.0
414,Lori Bell,phillipcook@example.org,31,626,Smartphone,160.10378811883925,414,2021-07-31 05:15:58,1,160.10378811883925,414,"Would agency hotel.
Law nature easy now story. Can color project ten less.",3.0
415,Bonnie Beard,fredgilbert@example.org,59,844,Tablet,1585.3743840359352,415,2023-09-19 07:57:15,3,4756.123152107806,415,Shoulder area industry care friend way nor. Family behind goal be hold prepare.,1.0
416,Rick Wade,williamsjoshua@example.net,22,123,Laptop,308.3528549509408,416,2022-11-16 07:10:13,4,1233.4114198037632,416,Force sometimes ago on pull better eat. Let clear include security pay.,
417,Megan Wilson,uwest@example.org,63,830,Laptop,1717.7055773476434,417,2021-02-15 08:16:09,1,1717.7055773476434,417,Song part ok few one rock high. Civil win according shake keep hard admit.,2.0
418,Lawrence Dominguez,karen94@example.net,51,287,Headphones,207.426281810341,418,2021-01-24 05:27:23,4,829.705127241364,418,Management information former sell discuss. Person almost bar cultural. Push western exactly.,3.0
419,James Combs,kramermichael@example.net,43,726,Laptop,1954.7327432274506,419,2020-08-19 04:24:59,1,1954.7327432274506,419,,3.0
420,Amanda Dawson,daniel85@example.org,44,352,Laptop,1493.1597276281286,420,2021-07-31 21:54:12,1,1493.1597276281286,420,"Take five girl. Inside find son nearly.
Any power with toward. Fill animal total available whole.",4.0
421,David Bruce,ronald06@example.com,50,440,Headphones,387.9825202669593,421,2021-11-20 08:23:08,1,387.9825202669593,421,Different fight staff out.,1.0
422,Brittney Frye,lcohen@example.net,46,872,Tablet,1818.8554320690077,422,2023-06-23 09:07:57,3,5456.566296207024,422,From money talk affect wonder security allow. Everybody notice arm visit.,
423,Jamie Smith,millerdaniel@example.net,58,928,Headphones,1397.2686569170028,423,2022-10-20 22:51:11,1,1397.2686569170028,423,Moment rest chair prevent. Seem do what pay. Design education poor need including.,3.0
424,Jennifer Booth,grant34@example.net,20,285,Smartphone,523.820877523824,424,2023-04-16 18:12:54,3,1571.462632571472,424,"Place early large page. Any move pretty apply.
Successful of audience event PM.",
425,Christopher James,dawncooper@example.net,41,326,Laptop,1152.5053287728797,425,2021-04-02 06:58:16,3,3457.515986318639,425,Of various tough life add task administration.,
426,Dwayne Moran,kirksmith@example.com,33,419,Smartphone,1455.3608057231286,426,2021-08-17 03:23:42,3,4366.082417169386,426,Commercial leave marriage piece. Receive base stock when east way.,4.0
427,Joshua Roberts,taylorgregory@example.net,22,186,Camera,999.7276866937025,427,2020-03-20 09:22:48,2,1999.455373387405,427,Once able south government throw. Else lawyer floor.,5.0
428,Lisa Davis,jamesraymond@example.org,24,462,Tablet,1154.0229073351773,428,2023-03-27 16:14:00,3,3462.0687220055315,428,Shoulder wind resource argue security.,5.0
429,Taylor Wise,hendrickslaura@example.net,58,338,Smartphone,1306.2104011265576,429,2020-11-17 01:39:06,4,5224.84160450623,429,,4.0
430,Lisa Odom,kirkmark@example.net,40,74,Tablet,1895.206475010178,430,2022-08-26 21:51:43,4,7580.825900040712,430,,5.0
431,Antonio Baxter,enichols@example.com,39,328,Laptop,459.03297693892125,431,2020-10-13 05:47:56,4,1836.131907755685,431,Strong and guess fill side economic. Place through throw too.,5.0
432,Sara Summers,qjones@example.net,43,413,Laptop,996.9461418196853,432,2021-04-28 20:52:41,4,3987.784567278741,432,Question may worker dream account behavior. Environmental our everything serve base.,1.0
433,Javier Rivera,destinytaylor@example.net,51,486,Camera,1128.194865469836,433,2021-09-29 19:01:00,3,3384.584596409508,433,Occur final area right. American thing size under.,1.0
