customer_id,customer_name,customer_email,customer_age,product_id,product_name,product_price,order_id,order_date,quantity_ordered,total_amount,review_id,review_text,review_rating
434,Andrew Bowman,ramirezdavid@example.org,50,801,Smartphone,562.0823207969012,434,2022-03-11 09:15:11,2,1124.1646415938023,434,,3.0
435,Nicholas Thomas,perkinstanya@example.org,63,919,Smartphone,1438.9937151914628,435,2021-05-29 13:12:51,3,4316.981145574388,435,Indicate building front college pull determine. Everything daughter plan five fire official.,3.0
436,George Mitchell,drobinson@example.org,22,422,Smartphone,1561.7572462119388,436,2021-05-15 23:27:24,3,4685.271738635816,436,Option measure rise.,
437,Kristin Holland,friley@example.net,22,609,Laptop,1247.8831648299704,437,2020-05-04 04:08:15,4,4991.5326593198815,437,Nature five talk up. Southern memory wide agency.,5.0
438,Amy Martin,tamiestes@example.com,56,207,Headphones,444.2127374998279,438,2020-05-28 20:12:13,4,1776.8509499993115,438,,1.0
439,Thomas Harper,parkererin@example.org,32,225,Laptop,1553.4117562357078,439,2023-08-10 06:33:18,2,3106.8235124714156,439,That reality anyone soon themselves set reach more. Challenge write must fall among he.,2.0
440,Elizabeth Williamson,christopherturner@example.net,53,491,Headphones,725.1954653637557,440,2022-07-04 06:07:32,1,725.1954653637557,440,,
441,Richard Parks,nicholegutierrez@example.net,49,692,Tablet,410.69571990747767,441,2023-05-14 16:30:38,4,1642.7828796299107,441,Area policy every peace fly help such. Sing discover last determine wonder.,
442,Martha Rodriguez DDS,sean20@example.org,43,244,Headphones,1648.2868594934776,442,2023-05-06 03:06:04,1,1648.2868594934776,442,,2.0
443,Cheryl Moreno,jennifersmith@example.org,29,698,Camera,1384.1428854672788,443,2021-08-07 23:15:31,3,4152.428656401837,443,Truth heart ahead coach increase drug.,5.0
444,Bobby Brown,bcantrell@example.org,47,60,Headphones,1154.2384541172403,444,2021-01-24 22:05:45,3,3462.7153623517206,444,,5.0
445,Whitney Palmer,derek60@example.net,41,388,Smartphone,1688.577306696926,445,2020-05-20 23:48:33,2,3377.154613393852,445,,4.0
446,Sherry Bowers,ymedina@example.com,19,816,Laptop,179.96516444671653,446,2022-05-16 07:33:43,2,359.93032889343306,446,Technology thank old I break.,
447,Alexa Martin DDS,evan78@example.net,18,647,Headphones,421.07633057495923,447,2020-08-09 17:25:26,2,842.1526611499185,447,,
448,Ryan Lyons,diana81@example.com,40,550,Headphones,1781.7300488380429,448,2022-05-28 02:16:13,2,3563.4600976760858,448,Tonight benefit child several accept stand poor. Land boy eat over rest.,3.0
449,Jacqueline Wilson,andersonsonya@example.org,30,82,Headphones,1635.7827748419277,449,2020-02-04 06:01:31,2,3271.5655496838554,449,,5.0
450,Katherine Nichols,dcurtis@example.net,42,338,Tablet,1663.0761376596818,450,2021-09-11 10:18:29,1,1663.0761376596818,450,Five next difference road want foot economic treat. Series despite positive stuff fish.,5.0
451,Ashley White,markmiranda@example.com,52,86,Camera,1338.4681323662635,451,2023-09-25 20:04:45,4,5353.872529465054,451,,1.0
452,Ms. Crystal Johnson,ftorres@example.org,43,704,Headphones,1163.5875418941196,452,2022-05-26 20:19:33,4,4654.350167576478,452,,1.0
453,Alexander Vargas,yjones@example.org,43,895,Tablet,1572.4606119029688,453,2023-05-31 05:00:08,3,4717.381835708907,453,Alone relationship coach and claim. Letter teach anything might factor where board.,
454,Christopher Baldwin,chaveztiffany@example.org,21,365,Smartphone,596.6484017120553,454,2022-05-17 10:12:13,3,1789.945205136166,454,Range poor market whom modern. Pretty decade end able Mrs.,1.0
455,Andrew Young,christophermurray@example.com,27,320,Headphones,1506.703239549495,455,2022-08-14 04:27:56,2,3013.40647909899,455,Spring argue quickly election dream.,3.0
456,Sara Gardner,hkline@example.org,63,274,Smartphone,356.2419578619652,456,2020-02-08 21:54:18,2,712.4839157239304,456,Could help nation name new. Affect room gun help.,
457,Megan Todd DDS,carlsonjudy@example.org,27,385,Laptop,1126.8105136816155,457,2020-07-04 18:52:23,3,3380.431541044846,457,,
458,William Duncan,lauren30@example.com,20,230,Camera,1577.3999979971281,458,2022-09-27 04:37:23,1,1577.3999979971281,458,Picture send base. City change of why somebody recognize response door.,
459,Stephen Owens,oluna@example.com,32,772,Headphones,499.08006435977137,459,2020-11-07 09:28:43,3,1497.2401930793142,459,Perform again second read believe president. Week think world friend serve.,1.0
460,Christina Davis,lararoger@example.com,48,688,Camera,693.7663021100502,460,2020-04-06 09:06:09,1,693.7663021100502,460,Nation professor less generation. Smile case more beautiful music word difficult would.,2.0
461,Lisa Mcclain,ashleywebster@example.com,18,673,Headphones,770.1277473796656,461,2022-12-11 15:44:10,2,1540.2554947593312,461,Light south attention return unit.,5.0
462,Jessica Ward,joseph45@example.net,60,645,Smartphone,482.83617825129454,462,2022-10-24 12:15:57,3,1448.5085347538836,462,"Seek street yet page laugh. Organization push small a see.
Available how bed occur beautiful.",
463,Debra Brown DDS,erika52@example.org,24,227,Laptop,453.2870936828563,463,2020-10-19 12:56:47,3,1359.861281048569,463,Pass will rock rise everybody. Information gas respond. Deal author matter walk local.,2.0
464,Aaron Allen,stephanie40@example.org,31,475,Tablet,427.928223865915,464,2020-08-04 03:18:11,2,855.85644773183,464,Whom bar senior beautiful road off. Clearly move picture cut. Prevent seem TV soldier approach.,1.0
465,Bailey Allen,sscott@example.com,46,404,Headphones,564.0507923281874,465,2022-11-05 01:53:13,4,2256.2031693127497,465,Range blood may get attack. Although ball heavy which.,4.0
466,John Wood,henry19@example.com,26,599,Tablet,789.398452331903,466,2021-06-27 04:39:30,3,2368.1953569957086,466,Crime as camera. Policy music check above focus new.,2.0
467,Megan Navarro,carolyndavis@example.com,23,663,Camera,300.9232516821966,467,2020-06-14 19:55:10,4,1203.6930067287865,467,Here cell hold account she. Ball this ever. Move family mouth owner.,2.0
468,Antonio Drake,carriewilliams@example.org,37,671,Tablet,470.9817513505301,468,2020-09-30 10:48:40,4,1883.9270054021204,468,Defense other while get pull check. Heart else involve reveal. About agent else movie three.,5.0
469,Emma Nguyen,tara02@example.org,24,925,Tablet,1837.2498955839287,469,2020-11-18 11:39:38,4,7348.999582335715,469,,
470,Christopher Winters,mwilliams@example.net,47,326,Laptop,1181.0823767434513,470,2022-02-21 07:28:56,1,1181.0823767434513,470,Past area natural own. Economic second chair realize certain produce real include.,
471,Corey Mejia,justin63@example.com,51,16,Headphones,834.4772769342607,471,2022-07-04 22:52:23,4,3337.9091077370426,471,Option message above black site enough where.,
472,Katelyn Huang,troyrichardson@example.net,57,37,Camera,1442.7964711747445,472,2021-03-26 05:57:43,1,1442.7964711747445,472,Spring network hit consider indicate along.,2.0
473,Stephen Douglas,santanatyler@example.net,32,326,Headphones,1198.7019035136145,473,2020-08-12 13:14:23,3,3596.1057105408436,473,Remain cut morning quality. Production nation here event property street good.,5.0
474,Sherry Hansen,nicholsonaaron@example.net,23,396,Headphones,134.8030373578392,474,2022-12-31 20:33:25,3,404.4091120735176,474,Yard how process we amount want employee. Clearly draw study movie traditional.,4.0
475,Brandy Solomon,kelleydawn@example.org,23,891,Laptop,347.08604119831716,475,2021-09-04 23:45:42,3,1041.2581235949515,475,Your concern here every set. Know country morning sometimes maintain bit recognize.,3.0
476,Jasmine Nixon,ballmeghan@example.net,60,604,Smartphone,1685.82976145985,476,2022-01-21 06:20:31,1,1685.82976145985,476,,
477,Robert Davis,holdenrobin@example.com,31,984,Headphones,1951.9170829733275,477,2022-11-28 18:25:48,2,3903.834165946655,477,Spring house pressure choice whole. War production discover.,5.0
478,Devon Austin,walkertony@example.net,22,620,Camera,1540.5634398341099,478,2021-05-06 08:50:34,3,4621.69031950233,478,Involve yet member huge which his husband reflect. Stock high avoid during. Pass past news.,3.0
479,Kimberly Green,lfloyd@example.com,29,718,Laptop,1270.7837433801365,479,2023-09-01 06:26:27,1,1270.7837433801365,479,,3.0
480,Shelia Shaw,zachary64@example.net,49,815,Camera,810.2354655579811,480,2023-01-08 11:13:13,1,810.2354655579811,480,,2.0
481,Ronald Campos,hdavis@example.net,24,244,Headphones,1033.208266021968,481,2023-07-05 12:36:46,4,4132.833064087872,481,Ask gas rest different again staff card.,
482,Jorge Pugh,mitchellamy@example.com,48,95,Smartphone,1979.241225873631,482,2023-03-07 02:38:18,2,3958.482451747262,482,Us allow certain century case. Student talk ground him.,3.0
483,Joshua Bond,ujohnson@example.net,62,450,Headphones,653.2102222660981,483,2021-10-13 01:17:39,3,1959.6306667982942,483,Arm agent too likely race west. Animal brother budget although peace brother.,3.0
484,Sandra Robertson,wellscharles@example.net,60,856,Smartphone,1075.8656772954137,484,2022-09-12 10:31:40,2,2151.7313545908273,484,,
485,Denise Schultz,bentonlaura@example.net,40,474,Smartphone,1340.414423810253,485,2021-06-06 18:13:52,3,4021.2432714307593,485,,
486,Christopher Boyd,amanda34@example.net,18,845,Laptop,852.2274181573848,486,2023-09-16 20:07:02,4,3408.9096726295393,486,,4.0
487,Christopher Taylor,cunninghamkelly@example.com,34,831,Tablet,1632.5530019552996,487,2021-07-09 14:01:19,1,1632.5530019552996,487,People live tree ready course wind. Agree democratic imagine attention every still.,3.0
488,Samantha House,millsjames@example.net,52,297,Smartphone,1658.7792231309988,488,2023-01-13 03:08:02,1,1658.7792231309988,488,,3.0
489,Donald Blanchard,tammygregory@example.org,32,54,Camera,558.4930298170701,489,2022-08-29 15:56:15,2,1116.9860596341402,489,Simple adult nothing eight. Well culture keep red responsibility energy.,5.0
490,Wanda Diaz,scott79@example.com,29,605,Tablet,1345.4684339002436,490,2020-12-07 08:16:45,2,2690.936867800487,490,Benefit professor security sign. Far life since end else top. Cause country book.,4.0
491,James Buchanan,martinezmarcus@example.net,60,344,Headphones,1851.0208915034714,491,2021-03-27 16:22:20,2,3702.0417830069428,491,Answer forget the enter idea fish.,
492,Gregory Cruz,cheryltaylor@example.net,29,344,Headphones,1595.7514652501518,492,2020-08-06 05:55:30,4,6383.005861000607,492,Left idea respond operation study. Quickly and surface away.,3.0
493,Sandra Hess,moorenicole@example.org,33,99,Camera,257.8585619269935,493,2021-08-01 02:12:56,1,257.8585619269935,493,Both part trip owner. White activity success. Door home skin stock.,
494,Candace Johnson,allisoncowan@example.net,61,534,Laptop,628.8497858097256,494,2021-04-24 10:24:44,2,1257.6995716194513,494,Event both tree citizen already television your wish. Stock stock shoulder though.,
495,Bethany Jackson,cristian73@example.org,41,780,Camera,1027.9204891505874,495,2020-04-15 07:19:27,1,1027.9204891505874,495,Star west example talk whether. Mind final north evidence front gas century.,3.0
496,Deborah Jackson,mcfarlandrichard@example.org,27,679,Camera,1456.634693178069,496,2021-12-05 03:00:11,4,5826.538772712276,496,"Recognize front pay need.
One away field believe. Friend partner television wide.",
497,John Robles,jose35@example.com,20,475,Laptop,1917.8198248076787,497,2021-11-23 17:51:38,3,5753.459474423036,497,Minute film miss heart treatment. Cup down my partner suffer type.,4.0
498,Teresa Walker,brooke87@example.org,58,961,Headphones,425.30779838068247,498,2021-03-27 21:29:25,3,1275.9233951420474,498,Material still according election behavior which performance. Hear sell part with of.,4.0
499,Mitchell Reynolds,kathryndixon@example.net,54,1,Tablet,279.9376830248814,499,2020-02-23 19:42:39,3,839.8130490746441,499,Information home matter father authority. Million cover teach production.,5.0
500,Scott Perez,normandeanna@example.com,27,905,Camera,1225.932137831764,500,2021-06-03 09:04:32,4,4903.728551327056,500,But today another join else life. Audience rather join fast. War question message them.,5.0
501,Tyler Taylor,simmonssusan@example.org,51,976,Headphones,1096.2417260444154,501,2022-02-25 13:05:54,4,4384.9669041776615,501,Perform entire out kind type. Continue water task herself.,2.0
502,Cheryl Black,michael08@example.org,64,139,Headphones,1395.6146916938446,502,2023-05-10 11:34:16,2,2791.2293833876893,502,Open magazine movement four discuss season trade.,5.0
503,Eric Boyd,trujillobruce@example.net,56,54,Camera,1345.3279086799691,503,2021-01-15 11:19:19,4,5381.311634719877,503,Choose old large baby. Agree create talk detail economic discuss believe. Agree measure reduce.,1.0
504,Lee Anderson,patrickgarcia@example.org,48,300,Smartphone,623.375891494107,504,2021-05-08 01:28:37,4,2493.503565976428,504,Painting another cut themselves party because.,5.0
505,Crystal Powell,dawsonperry@example.com,39,862,Camera,775.436173403152,505,2021-03-29 14:29:52,2,1550.872346806304,505,Already item five commercial. Music American owner technology color lay blue.,2.0
506,Mitchell Rose,vschneider@example.org,50,546,Laptop,1827.7977514897293,506,2020-11-01 11:33:39,3,5483.393254469188,506,Hold edge bed man someone treat. Week study reason attention.,4.0
507,Erik Underwood,mitchelljudith@example.com,19,11,Tablet,1690.7661099922702,507,2021-06-10 06:45:52,4,6763.064439969081,507,Model hotel arm start between mind class. Growth them safe how radio when.,4.0
508,Ashley Jenkins,ymcdaniel@example.com,29,107,Smartphone,1179.3806943619936,508,2020-02-05 00:11:52,2,2358.7613887239872,508,Where animal very foreign service. Direction alone everybody born direction measure.,2.0
509,Zachary Combs,mortonsean@example.com,40,245,Laptop,1716.0544506108276,509,2023-06-05 04:45:32,1,1716.0544506108276,509,"Sea data skill suggest end top night.
Time somebody choose moment Mr.",5.0
510,Shelly Vazquez,saramathis@example.org,49,881,Tablet,776.8944047363295,510,2023-08-17 19:28:28,3,2330.683214208989,510,Author weight section born. Already play stand different.,
511,Natasha Torres,lindsay70@example.com,47,118,Tablet,1577.4225072489016,511,2022-12-31 21:19:13,1,1577.4225072489016,511,Professor until eight rather group may. Arrive life you its see agency. Four none though pay.,4.0
512,Bradley Hall,sara39@example.net,18,509,Headphones,1502.3008616637778,512,2020-01-03 09:06:36,4,6009.203446655111,512,Run hospital others toward daughter. Table second high true matter remain.,2.0
513,Katherine Farrell,rebeccapaul@example.org,24,504,Camera,671.6787940531758,513,2023-05-28 17:14:20,4,2686.715176212703,513,,
514,Steven Harris,maldonadojeremiah@example.org,36,962,Camera,1172.8444874798367,514,2020-03-18 18:06:26,1,1172.8444874798367,514,Ever under owner glass. Audience walk mouth let provide. Peace rich this range.,3.0
515,Kenneth Hawkins,mistyboyd@example.com,54,405,Headphones,791.5778841219416,515,2022-01-12 00:16:22,3,2374.7336523658246,515,,1.0
516,Alexis Hill,nataliesanchez@example.com,39,236,Tablet,468.83255712491814,516,2020-01-14 19:14:44,2,937.6651142498363,516,,2.0
517,Johnny Short,gary36@example.org,34,199,Tablet,880.6522957398254,517,2021-12-18 00:29:47,4,3522.6091829593015,517,Story keep president create there establish ball.,1.0
518,Kimberly Pena,dominiquerodriguez@example.org,46,274,Laptop,780.2143475728412,518,2023-05-22 15:49:27,4,3120.857390291365,518,Point region church parent into accept. Pretty physical by learn.,
519,Robert Scott,steven57@example.com,41,167,Camera,885.531879472904,519,2022-11-12 19:53:09,2,1771.063758945808,519,Police be direction young want.,2.0
520,Donna Scott,beckylarson@example.net,52,491,Laptop,955.8979569005016,520,2020-06-09 14:39:27,3,2867.693870701505,520,Seek real buy risk local nature. Table thus worker evidence by grow road budget.,
521,Paula Ramos,omann@example.org,57,12,Smartphone,428.23989093432465,521,2023-06-29 15:51:19,3,1284.719672802974,521,,4.0
522,Brandon Carpenter,thomas64@example.com,47,38,Smartphone,356.0692185180554,522,2021-07-13 12:21:16,3,1068.2076555541662,522,No responsibility mean floor but for. Two start usually collection discuss church check.,
523,Daniel Hart,danielthompson@example.org,20,852,Headphones,852.2239717942499,523,2020-12-06 00:56:20,4,3408.8958871769996,523,Build case score manager trouble article to open.,3.0
524,Lisa Douglas,mcampbell@example.com,63,867,Camera,1982.3947769875886,524,2022-08-12 08:15:56,4,7929.579107950354,524,,
525,Joshua Brown,sreyes@example.net,32,296,Camera,1756.5122195011102,525,2021-02-03 15:55:46,2,3513.0244390022203,525,Ten growth bag through. Piece arm sell point old. Firm cost evening garden show stay.,5.0
526,Leonard Collins,nicholasdavis@example.com,34,72,Headphones,1259.4429445054318,526,2022-05-07 04:51:28,4,5037.771778021727,526,,3.0
527,Gary Scott,nealmichelle@example.org,27,891,Headphones,671.5587187518562,527,2023-04-06 07:38:01,1,671.5587187518562,527,,5.0
528,Joshua White,ericbryan@example.com,29,809,Camera,240.1396341231793,528,2020-02-08 01:31:34,3,720.4189023695378,528,When second seem argue high. General city just sort dream artist peace. Name create worry.,2.0
529,Todd Perry,houseallison@example.com,38,717,Smartphone,1710.7660571238757,529,2022-06-16 23:23:18,2,3421.5321142477515,529,Hit edge arrive. Mission international anyone civil decade once amount recent.,
530,Alicia Harper,timothydavis@example.com,30,248,Tablet,1395.3477981064216,530,2020-02-26 08:54:24,2,2790.695596212843,530,South same senior number. Situation within figure daughter guy organization his able.,2.0
531,Michele Todd,vancewilliam@example.org,52,207,Camera,1694.558309632246,531,2021-03-03 01:07:29,4,6778.233238528984,531,Smile food attention poor air. Any environment road wind manage office.,
532,Claire Taylor,chadedwards@example.org,47,369,Camera,1874.045539386494,532,2022-05-29 07:41:04,4,7496.182157545976,532,Look quickly role generation. Imagine top difficult community future.,4.0
533,Miss Natasha Cooper,abruce@example.com,63,823,Tablet,680.817346741633,533,2021-07-10 17:50:21,2,1361.634693483266,533,Contain carry several author answer drug. Like blue concern teach fast five head.,2.0
534,Lisa Levine,whiteheadandrew@example.com,55,812,Camera,1426.447961941943,534,2022-08-08 10:29:54,1,1426.447961941943,534,Into beyond president act. Drop direction great director.,3.0
535,Holly Thompson,franklin62@example.net,24,685,Smartphone,1912.6295332812956,535,2021-01-25 02:54:21,4,7650.518133125182,535,Heavy child as choose could whole. Street particularly section six. You leg entire entire hundred.,
536,Christine Pearson,gpalmer@example.net,49,928,Laptop,1800.9385582192028,536,2022-04-07 01:04:57,2,3601.8771164384057,536,,2.0
537,Christina Snow,leahrobles@example.org,23,830,Headphones,1431.6631020557788,537,2020-05-07 07:23:02,4,5726.652408223115,537,What relationship last consider these. Because yourself kitchen. Loss meet begin strategy because.,4.0
538,Crystal Reese,dakota47@example.org,19,113,Tablet,1593.539915568287,538,2020-07-01 15:21:39,3,4780.6197467048605,538,Whatever spring young bring. We minute control church relationship allow street.,
539,Tracy Richardson,pwallace@example.net,46,821,Laptop,1196.6343219252947,539,2023-06-05 13:50:36,4,4786.537287701179,539,,1.0
540,Jacqueline Morgan,amberfisher@example.com,32,536,Tablet,1335.7505361012084,540,2023-09-14 21:05:09,3,4007.2516083036253,540,Than set upon. Class such military too.,1.0
541,Lauren Carter,edward80@example.net,20,675,Laptop,983.6626436840443,541,2020-09-12 22:23:57,1,983.6626436840443,541,,2.0
542,Daniel Walker,mariah37@example.net,38,637,Headphones,477.88365363287517,542,2023-03-13 02:05:19,2,955.7673072657503,542,,2.0
543,Samuel Rodriguez,georgeadams@example.net,31,137,Camera,866.3042083428865,543,2020-02-02 21:04:15,3,2598.9126250286595,543,Customer bank office friend drive visit. Gas concern Congress foreign improve money you.,4.0
544,Stephen Padilla,james27@example.org,48,231,Headphones,400.96442116035723,544,2020-12-01 03:06:12,3,1202.8932634810717,544,Reason miss charge foreign fear. Cover want reality set body town wear.,3.0
545,Ronald Thompson,rebecca27@example.com,32,46,Headphones,523.5524506582082,545,2022-05-10 07:25:52,2,1047.1049013164163,545,Government unit car ready amount total. Mother customer several. See beat peace individual.,
546,Rachel Willis,djames@example.com,35,999,Camera,1252.1932507238587,546,2022-10-27 05:10:27,4,5008.773002895435,546,Act war likely scene. Energy family simply tend by very animal.,5.0
547,Rebecca Ramirez,ocallahan@example.com,38,621,Headphones,473.04641008749996,547,2020-01-31 12:40:18,2,946.0928201749999,547,,3.0
548,Justin Davidson,osmith@example.net,47,118,Tablet,429.9668642590051,548,2022-01-27 02:07:55,4,1719.8674570360204,548,Tv work year approach box security read.,1.0
549,Jimmy Jones,saraguerra@example.net,19,524,Laptop,213.19880601467423,549,2020-12-31 09:44:12,4,852.7952240586969,549,,4.0
550,Amanda Jones,gwhite@example.net,25,795,Smartphone,1527.7654189326597,550,2023-09-09 15:45:18,2,3055.5308378653194,550,Place your but ten. Agree situation control television market spend.,4.0
551,Steven Hughes MD,robert56@example.org,58,371,Smartphone,1859.8298795767296,551,2020-10-31 17:05:09,3,5579.489638730189,551,Building newspaper go.,3.0
552,Roger Ryan,harriszachary@example.org,39,868,Headphones,1597.928618725984,552,2023-03-14 02:10:46,3,4793.785856177952,552,Head painting part call focus market. Forward very high unit think audience everyone wait.,3.0
553,Amy Lee,mboyd@example.org,59,527,Smartphone,1139.130545045131,553,2023-04-01 17:43:23,1,1139.130545045131,553,Goal two environment culture shake. Social open by study issue brother.,2.0
554,Christina Jackson,taylorcraig@example.com,37,464,Tablet,1719.3810077331232,554,2021-03-21 04:30:35,3,5158.143023199369,554,,2.0
555,Grace Chang,michellemorrow@example.org,53,547,Smartphone,529.6454593457901,555,2022-02-26 06:24:54,3,1588.93637803737,555,,4.0
556,Gregory Medina,hooverjames@example.com,62,359,Headphones,1641.265300330707,556,2022-06-11 11:40:04,3,4923.7959009921215,556,"Senior prevent agency good doctor type natural.
Quite property market kind.",
557,Kyle Martin,kelseysimmons@example.com,30,925,Smartphone,1366.383918881584,557,2021-06-21 02:30:49,1,1366.383918881584,557,History image course responsibility resource season yard they.,4.0
558,Elizabeth Harris,christopher74@example.com,45,344,Smartphone,1497.343013998268,558,2023-08-22 05:27:41,4,5989.372055993072,558,,
559,Heather Anderson,abigailbuchanan@example.com,33,868,Laptop,493.69527376951294,559,2020-06-25 08:26:29,4,1974.7810950780517,559,,
560,Ann Larsen MD,robert09@example.org,39,462,Tablet,1709.9616867295047,560,2022-09-02 15:17:50,2,3419.9233734590093,560,Surface some TV course. Pay policy bill production.,
561,Jennifer May,pattersonlaura@example.com,30,324,Tablet,1832.2583112802747,561,2023-01-11 10:32:50,3,5496.774933840824,561,Crime travel protect staff. Purpose to speech off I pull.,
562,Brittany Wilson,beverlyowen@example.org,34,336,Smartphone,1097.194341690718,562,2022-09-23 05:49:20,2,2194.388683381436,562,Close four information treatment. Head country decision fall past Mr.,
563,Jennifer Lowery,fmorris@example.org,60,236,Camera,876.3611125015256,563,2022-11-22 18:00:22,2,1752.722225003051,563,Capital large kind but stand. Safe task within particularly shake notice. Wife score source.,
564,Cassie Bray,vanessa66@example.com,41,167,Smartphone,1297.730165954065,564,2021-08-18 16:30:12,4,5190.92066381626,564,Senior officer side type one raise region rule. Too area ago policy think.,5.0
565,Amy Christian,inelson@example.org,19,270,Smartphone,320.68211446677196,565,2021-05-17 14:36:09,4,1282.7284578670879,565,,
566,Jordan Raymond,umartinez@example.com,23,333,Tablet,950.2955311449624,566,2022-12-29 06:26:47,3,2850.8865934348873,566,,4.0
567,Corey Owen,karen05@example.com,26,32,Laptop,816.3527644786767,567,2021-02-26 21:30:05,4,3265.411057914707,567,Land cut number generation both. Choose every even explain.,3.0
568,Debra Anderson,michaelgolden@example.com,46,804,Headphones,1267.7572271568938,568,2020-07-14 06:14:46,3,3803.2716814706814,568,,5.0
569,Katelyn Avila,morganbrenda@example.org,25,86,Headphones,1085.0046569871304,569,2021-06-06 13:27:52,3,3255.0139709613914,569,Of environment manager ready page explain. Analysis role image consumer expect hospital baby.,5.0
570,Andre Mitchell,kvillanueva@example.com,37,621,Smartphone,191.51168799094035,570,2021-09-22 04:25:18,2,383.0233759818807,570,,
571,Michael Rodriguez,shanegarner@example.net,49,398,Headphones,1750.176246896977,571,2023-04-09 20:11:19,3,5250.528740690931,571,,5.0
572,Joseph Thornton,loganhowell@example.org,54,684,Laptop,229.0739642510048,572,2020-06-06 19:39:53,3,687.2218927530145,572,Action create decade not none. Whether success understand bad.,3.0
573,Autumn Rose,wchavez@example.org,48,916,Laptop,722.3776508692803,573,2021-01-27 16:29:26,3,2167.1329526078407,573,,
574,Angela Morton,perrysue@example.org,24,770,Smartphone,127.23837287014982,574,2021-07-13 11:44:59,2,254.47674574029963,574,,2.0
575,Maria Graham,nrussell@example.com,50,673,Camera,1390.9117425014658,575,2020-05-01 22:04:36,1,1390.9117425014658,575,Scene for town thought over. Action market concern audience modern.,
576,Mark Hill,ehowell@example.net,40,183,Camera,1230.8566941396118,576,2020-10-26 07:17:03,2,2461.7133882792236,576,,5.0
577,Betty Anderson,ghayes@example.org,50,579,Tablet,1332.213939358635,577,2022-07-26 11:07:36,4,5328.85575743454,577,Your window audience most way join. Send approach yeah once.,1.0
578,Christopher Vasquez,joseph77@example.com,19,379,Tablet,651.1503689682573,578,2020-11-28 19:29:05,1,651.1503689682573,578,Painting they rule general war late organization. Cause them fear ready.,5.0
