customer_id,customer_name,customer_email,customer_age,product_id,product_name,product_price,order_id,order_date,quantity_ordered,total_amount,review_id,review_text,review_rating
579,John Knight,morrischristopher@example.org,52,49,Tablet,1233.9924874703843,579,2022-07-09 22:49:07,2,2467.9849749407686,579,Book window food agree painting live. Detail ready study structure.,5.0
580,Sarah Hodge,lisaguzman@example.com,42,211,Smartphone,671.2034005881686,580,2022-10-01 05:17:35,2,1342.4068011763372,580,,4.0
581,Jeff Gonzalez,elizabeth45@example.net,60,5,Laptop,371.0402917963652,581,2023-03-06 07:59:25,1,371.0402917963652,581,Information early when large often within. Young safe someone sea.,3.0
582,Carlos Warren,pricebrandy@example.net,51,542,Smartphone,1120.3225725963039,582,2022-03-04 03:38:35,4,4481.2902903852155,582,,
583,Natasha Ingram,jessica80@example.com,39,390,Tablet,1399.3009995362245,583,2022-06-15 18:42:51,2,2798.601999072449,583,,1.0
584,Jackie Davis,sbyrd@example.com,44,858,Tablet,1897.1894401011912,584,2020-03-17 12:08:54,2,3794.3788802023823,584,Table week imagine situation just.,
585,Katherine Stone,robertsjessica@example.com,59,173,Laptop,1159.3376628170097,585,2020-06-12 03:27:50,3,3478.012988451029,585,,1.0
586,Kimberly Sullivan,anneboyd@example.net,24,852,Tablet,363.83749165670815,586,2022-07-18 08:33:30,3,1091.5124749701245,586,Those possible carry administration top dog. Add improve gun region room reflect manager right.,1.0
587,Christina Hendrix,jamesjackson@example.net,37,318,Tablet,1210.0838467399406,587,2020-06-30 08:35:54,4,4840.335386959762,587,Involve house project citizen seven wide tell. Material actually half make attack.,1.0
588,Thomas Smith,davidmorris@example.com,64,651,Camera,1723.5374383293865,588,2023-03-12 07:07:01,3,5170.61231498816,588,Hospital case book. Set book town fine interview life democratic.,
589,Tyrone West,nhill@example.net,62,867,Headphones,916.6111003457178,589,2020-10-27 04:24:01,2,1833.2222006914355,589,Upon your whole glass. Loss anyone study amount focus minute same.,4.0
590,Gregory Mathews,carterlinda@example.net,58,889,Camera,1742.6752395931194,590,2022-06-05 14:44:12,3,5228.025718779358,590,Behavior write miss wall. Buy small bag foot. Lose response focus whole.,4.0
591,Samantha Abbott MD,kristen72@example.org,38,729,Camera,939.8594482156835,591,2022-10-23 13:54:18,4,3759.437792862734,591,,2.0
592,Michael Hill,joseph00@example.net,47,456,Camera,885.8518760896944,592,2020-03-10 16:24:14,1,885.8518760896944,592,Us girl line less cut change. North save safe class sound fish.,
593,Lauren Thomas,mike61@example.com,39,772,Headphones,1555.9090577814393,593,2020-05-24 05:04:00,4,6223.636231125757,593,Yet public indeed specific. Box might while eye market.,
594,Patrick Richards,milleramber@example.com,52,916,Laptop,1022.3482056583006,594,2022-11-10 15:20:16,4,4089.3928226332023,594,,4.0
595,Amy Bauer,derrick75@example.net,24,588,Headphones,574.1823216468996,595,2021-05-18 23:15:59,3,1722.5469649406987,595,Bad she they key exactly. Everything word station official.,4.0
596,Tonya Erickson PhD,gilbertrichard@example.com,28,27,Smartphone,1245.0219680362584,596,2022-12-10 01:47:38,2,2490.0439360725168,596,,4.0
597,Timothy Peters,kenneth47@example.com,54,960,Headphones,1637.5795986511162,597,2021-05-18 12:18:41,1,1637.5795986511162,597,,5.0
598,Justin Walker,pearsonsavannah@example.com,59,597,Tablet,1160.089145146522,598,2020-01-25 03:06:10,3,3480.267435439566,598,May financial can executive method. Subject success school individual religious. Add care point.,3.0
599,David Woods,ashley14@example.net,39,485,Laptop,663.6653435261799,599,2023-05-28 05:22:08,3,1990.9960305785396,599,His eight physical business read three. Quite program answer environment right my break never.,5.0
600,Yvonne Mejia,kingmargaret@example.net,55,331,Tablet,472.13133468532396,600,2020-10-04 19:36:31,4,1888.5253387412959,600,,2.0
601,Amanda Clements,awalker@example.org,46,563,Headphones,139.14410602953996,601,2021-08-13 21:34:49,2,278.2882120590799,601,Change subject church kid. Center though firm full easy.,
602,Robin Brooks,andersonmonica@example.org,24,650,Smartphone,784.2076012439599,602,2021-01-09 15:14:39,4,3136.8304049758394,602,,1.0
603,Melissa Jensen,cannonjose@example.org,47,388,Camera,1478.4658352962783,603,2020-06-21 12:53:26,1,1478.4658352962783,603,Factor certainly station choice.,
604,Richard Jackson,woodardalison@example.org,23,47,Smartphone,787.1395233939869,604,2023-04-13 21:25:16,2,1574.2790467879738,604,,
605,Jodi Garcia,schung@example.com,54,919,Tablet,1665.7675584166097,605,2023-09-20 04:33:44,3,4997.302675249829,605,Born four near suffer move history Democrat happy. Dream song avoid direction job agent.,5.0
606,Anthony Hampton,lindsaykelly@example.com,22,420,Camera,100.32923593954428,606,2021-05-17 00:04:34,3,300.9877078186328,606,Teach hand agree capital. Employee suffer fast parent whole religious ability.,4.0
607,Janice Sims,pamelakrueger@example.org,19,708,Smartphone,1532.3104191120055,607,2022-08-06 20:02:59,3,4596.931257336017,607,Develop alone avoid reduce themselves. Speak seat mind offer Congress two process read.,
608,Rachel Wood,nicolekrause@example.com,23,999,Tablet,1061.776633883121,608,2020-04-14 22:02:03,2,2123.553267766242,608,,3.0
609,Kevin Anderson,operry@example.org,48,501,Tablet,219.46372495587832,609,2022-11-20 00:30:17,2,438.92744991175664,609,Want goal develop once single. Sort according bring certain now action.,2.0
610,Lauren Knight,pberger@example.net,59,826,Laptop,417.7716691497368,610,2022-11-17 22:07:21,4,1671.0866765989472,610,Financial economic training cold probably himself majority. Center vote according.,
611,Natalie Little,jessicagreen@example.com,47,467,Smartphone,1675.1433815713165,611,2023-02-12 03:31:26,4,6700.573526285266,611,"With behind adult.
Nor activity much safe different. Talk never law sort she model.",
612,Edgar Singleton,penasarah@example.com,25,721,Tablet,373.41472043753623,612,2021-07-13 06:46:42,3,1120.2441613126086,612,But air move. Issue improve investment each. Share reason image herself suggest direction school.,4.0
613,Virginia Thomas,james63@example.net,57,334,Tablet,1348.1849123126206,613,2022-02-10 00:19:59,3,4044.554736937862,613,Manage indicate year old. Suggest easy west way himself hotel speak.,1.0
614,Erica Wells,srobinson@example.net,36,817,Smartphone,1385.8807458135873,614,2022-06-22 04:58:34,4,5543.522983254349,614,Road however charge family get. Subject safe painting forward indicate use.,1.0
615,Zachary Walters,aguilarjulie@example.net,57,324,Laptop,811.1496262909424,615,2022-03-20 23:33:50,4,3244.5985051637695,615,Amount also couple than. Herself film left. Involve sense less green sit fire foot.,1.0
616,Terrance Johnson,qcarter@example.com,42,428,Headphones,1726.762171703518,616,2022-10-25 16:35:08,2,3453.524343407036,616,Nothing prevent table back. Offer agreement listen shoulder score listen American.,1.0
617,Steven Welch,hannah39@example.com,47,20,Laptop,1861.0397981279073,617,2021-11-12 14:48:20,2,3722.0795962558145,617,,1.0
618,Kyle Howard,roberthorn@example.com,24,905,Tablet,414.5966454732069,618,2023-04-23 13:22:51,4,1658.3865818928275,618,Positive action phone could read style. Day even real. Chair century control break keep.,2.0
619,Daniel Gilbert,ecoleman@example.com,38,577,Laptop,163.0566316103139,619,2021-01-02 16:11:29,3,489.1698948309417,619,,1.0
620,Kenneth Herrera,kevin59@example.com,30,991,Camera,1552.1023725242685,620,2022-04-06 00:13:17,3,4656.3071175728055,620,Capital expect high organization. Believe hard officer available become.,3.0
621,Stephanie Williams,laurensteele@example.org,22,307,Smartphone,1124.957949220466,621,2020-09-25 02:47:50,2,2249.915898440932,621,Career image change sister. Discuss trial deal article stage rest guy culture.,5.0
622,Christina Perez,fcruz@example.net,41,134,Laptop,516.6057004978984,622,2021-05-01 02:47:51,3,1549.8171014936952,622,Us level market amount candidate. Physical candidate simple character phone audience determine.,5.0
623,Christine Jackson,sarahmitchell@example.org,35,318,Smartphone,1330.7073377974416,623,2021-05-11 09:30:22,3,3992.122013392325,623,Turn sea player paper huge civil this great. Leg career maintain station again eat.,
624,Edward Morris,russelldarlene@example.net,25,621,Headphones,1126.3010707818776,624,2020-06-15 19:03:52,4,4505.20428312751,624,Somebody police very itself. Cell set sit dog these.,
625,Virginia Flores,karajohnson@example.org,27,313,Camera,140.36834896591944,625,2020-09-10 21:22:56,4,561.4733958636778,625,Still continue computer process project free which.,2.0
626,Mary Carson,natalie57@example.org,31,941,Camera,1728.837329122536,626,2020-09-10 21:19:06,2,3457.674658245072,626,,
627,David Weber,garnerkelly@example.com,51,891,Camera,565.4298463444451,627,2023-04-14 14:00:17,3,1696.2895390333351,627,Agreement color factor way page. Decade eight good thousand.,4.0
628,Deborah Wise,shieldsrebecca@example.org,31,281,Smartphone,379.35854672801344,628,2021-09-09 23:08:14,1,379.35854672801344,628,Medical more most develop. Other billion growth especially up character their.,1.0
629,Jessica West,hcooper@example.net,48,776,Tablet,1174.7847526601875,629,2021-10-23 02:28:00,3,3524.3542579805626,629,Bit win rock between. Home other down feeling will common. Head until law member how view.,5.0
630,Kevin Mccarty,charles38@example.net,52,50,Headphones,204.6160519654668,630,2023-02-23 01:14:32,4,818.4642078618672,630,,
631,Stephanie Arnold,kevinlevy@example.org,48,224,Tablet,151.11013705545543,631,2021-11-08 02:06:36,4,604.4405482218217,631,,
632,Shawn Randall,heidiholmes@example.net,63,268,Laptop,1205.299786337181,632,2022-05-12 00:22:35,2,2410.599572674362,632,"School describe service body indeed produce.
Degree even tough our. Movie follow religious should.",4.0
633,Erin Brown,ekramer@example.org,35,192,Laptop,1271.501415411356,633,2021-02-07 18:36:09,4,5086.005661645424,633,Fight box past. Prepare mother fact table direction expert.,1.0
634,Thomas Mcknight,mkerr@example.org,22,208,Smartphone,151.66782032381047,634,2023-01-30 00:00:09,1,151.66782032381047,634,Develop material task care your very. Audience may design. Sell relate even.,
635,Kevin Gill Jr.,bpatrick@example.org,63,315,Camera,549.9054383665348,635,2022-03-03 10:24:01,4,2199.621753466139,635,Knowledge daughter under method already return interview. Fight maybe challenge build can.,
636,David Washington,millerandrew@example.net,54,288,Tablet,1224.0602543016366,636,2023-08-11 15:05:46,1,1224.0602543016366,636,Individual far this affect everybody white. While throughout my plant girl. They nature today.,5.0
637,Charles Olson,robert37@example.com,34,31,Headphones,504.89848915473965,637,2023-05-06 16:10:21,2,1009.7969783094793,637,Finish probably firm. Big industry across phone. Quite smile under door go store admit.,4.0
638,Joseph Carter,jason04@example.com,54,227,Laptop,712.1889883554924,638,2021-09-12 02:39:11,4,2848.7559534219695,638,Group mind chair available control company.,3.0
639,Luke Wright,thomas14@example.org,23,714,Camera,350.72621212941374,639,2022-03-18 22:59:33,4,1402.904848517655,639,Strategy something soon ten.,5.0
640,Cynthia Vasquez,amanda90@example.net,46,323,Smartphone,1099.9262996934362,640,2022-12-03 13:05:05,2,2199.8525993868725,640,Wear light newspaper present teach. Perhaps whatever see race certain. Many choose start job save.,2.0
641,Phillip Gilmore,farmstrong@example.org,61,118,Smartphone,876.771121080434,641,2022-04-01 22:18:56,3,2630.313363241302,641,,2.0
642,Charles Perez,moraleslindsey@example.com,38,898,Tablet,1646.204647710639,642,2023-04-20 04:50:11,2,3292.409295421278,642,Do compare much. Grow alone prove force article information.,
643,Tina Collins,rodney23@example.net,28,381,Camera,313.24093254151023,643,2020-10-18 23:30:03,1,313.24093254151023,643,Big account move race performance from. Support put believe between strategy free.,
644,Cathy Frank,friggs@example.net,21,471,Camera,279.74108042522005,644,2020-01-09 14:46:29,1,279.74108042522005,644,Suffer little energy cell hit behind rock. Use benefit like own movie behind especially.,4.0
645,Eric Murray,christophergonzalez@example.org,60,194,Laptop,1390.1305603149242,645,2020-07-27 08:29:29,1,1390.1305603149242,645,,2.0
646,Christopher Johnson,christine12@example.net,64,626,Camera,555.5119805080726,646,2023-06-01 14:26:25,1,555.5119805080726,646,Book any indeed enter treat inside yourself. Organization end though tonight.,3.0
647,Stephanie Torres,jessethomas@example.com,62,612,Laptop,859.5311648575076,647,2022-04-21 02:34:17,2,1719.0623297150153,647,,1.0
648,Jessica Giles,wrightjennifer@example.com,41,694,Headphones,151.31852478974244,648,2021-01-05 07:33:20,1,151.31852478974244,648,Ten people stand house. Catch question idea real.,
649,Timothy Chapman,jeffreybrown@example.org,39,685,Camera,1056.0310736516549,649,2022-01-02 19:06:36,3,3168.0932209549646,649,Sea possible first art result attention. The campaign out business situation. Choose fall sound.,
650,Jennifer Smith,andrew67@example.net,23,979,Smartphone,1772.0979471927756,650,2020-07-13 06:05:18,4,7088.391788771102,650,Natural mind over him year large series purpose. Enter son responsibility result total their.,2.0
651,Rebekah Gomez,stevenmcclain@example.org,60,752,Laptop,1434.3466325173397,651,2021-03-29 15:12:46,4,5737.386530069359,651,Trip you fast industry hit money. Until city economic. Maintain character body boy benefit rather.,4.0
652,Melanie Sanchez,hurstlisa@example.org,48,578,Camera,1240.413192485466,652,2020-06-09 22:07:32,2,2480.826384970932,652,Job fill itself accept last out long very.,5.0
653,Gregory Cummings,kimbrian@example.org,63,603,Tablet,1995.0440703517377,653,2021-10-16 18:52:10,1,1995.0440703517377,653,,1.0
654,Janet White,adam29@example.com,50,511,Smartphone,430.5644849334007,654,2021-10-09 20:17:34,1,430.5644849334007,654,Reduce hear student pay enjoy appear end. Need similar truth to sign.,5.0
655,Angela Snyder,burgesstaylor@example.com,57,154,Camera,1200.058789354735,655,2022-01-28 22:56:44,1,1200.058789354735,655,,
656,Diane Glass,adrian53@example.net,31,548,Headphones,106.69383855115524,656,2020-02-19 16:30:24,1,106.69383855115524,656,Ready happen today call. Interesting popular lay write.,4.0
657,Patricia Williams,lynchedwin@example.org,39,395,Tablet,1973.569450627043,657,2021-06-01 05:42:01,4,7894.277802508172,657,"Bill mouth source discussion onto item record.
Audience drug director somebody behind anything.",3.0
658,Teresa Salas,cole64@example.com,40,334,Camera,1840.1728639275068,658,2021-08-22 12:16:26,3,5520.51859178252,658,By fast pull. Among involve many day campaign cold drop.,1.0
659,Ronald Moreno,clayandrew@example.com,55,212,Laptop,858.223399433735,659,2022-01-08 23:35:11,2,1716.44679886747,659,Machine under sign record. Such piece sign evidence show.,2.0
660,Madison Williams,walshtimothy@example.org,33,875,Headphones,1589.7831875753639,660,2021-09-24 13:31:25,4,6359.132750301455,660,Idea interview which style mind. Interest song budget case.,
661,Shawn Key,angelasmith@example.com,55,96,Laptop,956.6286463724462,661,2021-01-19 17:43:44,4,3826.5145854897846,661,Bag artist should. Hundred great window. Executive law arrive reality listen question threat.,4.0
662,James Peterson,andersonbrenda@example.net,50,539,Headphones,516.1822766351503,662,2023-07-18 10:05:34,1,516.1822766351503,662,Month worry guess open news how. Be cultural throughout nothing.,
663,Morgan Turner,angel97@example.net,60,197,Laptop,564.7856672120784,663,2023-06-23 20:04:06,3,1694.357001636235,663,,2.0
664,Matthew Berry,poncechristopher@example.net,51,372,Tablet,437.09622600409404,664,2023-09-12 08:09:55,3,1311.2886780122822,664,Turn majority audience can. Every wide management agent. Kitchen wide those your.,2.0
665,Stephanie Johnson,greenerik@example.org,47,142,Camera,1675.1564536780836,665,2023-08-31 20:45:58,1,1675.1564536780836,665,,3.0
666,Ashley Vargas,rachel08@example.com,40,86,Laptop,484.62373156265363,666,2021-12-01 08:30:00,4,1938.4949262506145,666,Loss mind increase buy. Front tree me water. College tree college pull.,5.0
667,Roger Johnson,yrivera@example.com,38,583,Camera,1159.9553770974208,667,2020-07-13 06:31:35,4,4639.821508389683,667,,3.0
668,Latoya Castro,harveyangela@example.com,59,654,Tablet,364.2771690638855,668,2022-05-07 09:56:56,3,1092.8315071916563,668,"Director character wear interesting.
Course reason traditional model work season.",5.0
669,Robert Fleming,tylergonzalez@example.com,26,446,Tablet,982.8468906240656,669,2020-02-26 17:28:23,1,982.8468906240656,669,Professor indeed performance everybody rise product minute water. Agreement executive laugh minute.,
670,Jason Stanley,luisbrown@example.com,45,417,Smartphone,1012.8226996892562,670,2020-03-22 09:23:57,2,2025.6453993785124,670,Feel treatment heart provide down. Decade change husband among. Case air plan civil.,4.0
671,Jeff Romero,brownmichael@example.com,43,205,Smartphone,675.0677883872472,671,2021-08-25 16:14:01,1,675.0677883872472,671,American measure information to financial. Authority science ok agreement here across life.,
672,Gina Vasquez,rhondaphillips@example.net,34,776,Camera,1494.9117671370257,672,2020-04-28 04:53:18,2,2989.8235342740513,672,,2.0
673,Valerie Blake,ramosmariah@example.net,45,187,Smartphone,649.0370869710035,673,2023-01-17 14:06:41,3,1947.1112609130105,673,,4.0
674,Sherry Robertson,julia52@example.com,30,675,Smartphone,697.00333948031,674,2021-11-04 17:02:27,3,2091.0100184409303,674,Something which large live least bar have. Move month as single especially.,2.0
675,Matthew Sandoval,melinda88@example.net,64,94,Headphones,789.5220545824749,675,2020-01-15 03:31:06,1,789.5220545824749,675,Out set reveal. Agent cultural they seat draw practice.,
676,Michael Singleton,michelleschwartz@example.org,29,586,Laptop,217.0959359333366,676,2021-06-08 22:23:11,1,217.0959359333366,676,"Always road perhaps about mother power rate.
Town turn run rate age probably set. Mouth draw these.",5.0
677,Robert Bush,tchan@example.com,35,502,Laptop,379.7842542063114,677,2023-05-10 13:32:48,2,759.5685084126228,677,,
678,Spencer Brown,patrickfrank@example.net,42,221,Smartphone,1472.5292621153933,678,2023-06-12 10:42:51,3,4417.58778634618,678,,4.0
679,Jason Stokes,jose54@example.com,41,532,Camera,1903.957880594124,679,2020-05-10 12:43:24,4,7615.831522376496,679,Cause reduce contain blood role above figure. Girl mother south draw wall quickly concern.,2.0
680,Jermaine Brown,rrobinson@example.org,41,303,Camera,279.54506775595655,680,2022-01-17 19:41:22,1,279.54506775595655,680,Each wish must me memory money. Notice hospital player Congress.,4.0
681,Brian George,erika39@example.org,53,255,Smartphone,1964.8176235007645,681,2020-10-28 09:17:41,2,3929.635247001529,681,Some white strong capital. Baby politics natural control between home.,2.0
682,Belinda Singh,sfisher@example.net,59,726,Laptop,156.623340004685,682,2021-09-21 15:15:59,1,156.623340004685,682,Because himself make itself. Board possible tell I serve. Design task station.,3.0
683,Julie Scott,matakaren@example.org,32,6,Headphones,1410.00715705293,683,2022-10-20 02:18:39,3,4230.0214711587905,683,After able Democrat arm. His policy on list address drop. Theory person fine goal.,4.0
684,James Foster,snyderhaley@example.com,60,697,Headphones,157.0895110051875,684,2023-03-09 19:51:42,2,314.179022010375,684,Finally record home education win morning. Himself stage test member none all company.,
685,Ashley Shaw,benjaminjohnson@example.org,53,914,Camera,325.27842686580675,685,2021-08-07 00:56:00,2,650.5568537316135,685,Project product travel reduce through. Go war anyone. Team hope attorney country science general.,4.0
686,Peggy Taylor,zguerra@example.org,21,431,Smartphone,1964.7911321980887,686,2021-03-06 06:29:45,2,3929.5822643961774,686,Suddenly important never field everything sometimes. Myself above word.,3.0
687,Julie Huynh,hilljackie@example.org,64,721,Camera,338.8273895069715,687,2022-08-20 23:45:02,1,338.8273895069715,687,Leave gas those use listen imagine enter. Recognize voice wind.,5.0
688,Amy Johnson,valdezemily@example.com,63,65,Tablet,659.2361532603991,688,2022-01-20 10:12:15,1,659.2361532603991,688,Kid fight Republican teach notice nor watch. Production interest choice perhaps head.,5.0
689,Michael Rodriguez,hdoyle@example.org,52,497,Tablet,660.0394968200115,689,2023-02-20 14:29:35,1,660.0394968200115,689,Feeling message each beautiful. Deal should sing western rather.,
690,Stephanie Gray,spennington@example.com,29,852,Headphones,991.7247114927121,690,2022-06-21 19:56:20,4,3966.8988459708485,690,,
691,Mark Bowman,michaelmckinney@example.org,52,932,Smartphone,1057.7973951739857,691,2022-07-25 23:45:32,2,2115.5947903479714,691,,1.0
692,Margaret Vaughan,bholloway@example.com,21,873,Laptop,1626.6404143338038,692,2022-08-10 01:47:40,1,1626.6404143338038,692,Attorney necessary event. Rule culture partner. Arrive cultural education.,
693,Corey Perez,tammy37@example.net,24,859,Headphones,452.1431628509188,693,2023-05-23 15:58:50,3,1356.4294885527565,693,Against save dog painting. Several production forget hit then somebody.,1.0
694,Dr. Anna Bell,qwalls@example.org,55,26,Headphones,1451.9362557063864,694,2020-02-04 09:37:37,1,1451.9362557063864,694,,2.0
695,Jacqueline Hardy,donna18@example.org,55,98,Camera,197.44932629414672,695,2022-11-21 21:18:19,1,197.44932629414672,695,,2.0
696,Christian Hayes Jr.,oreilly@example.net,45,442,Tablet,610.152705518083,696,2022-05-17 19:35:34,4,2440.610822072332,696,Cold model our very later son technology activity. Size especially not start debate particularly.,5.0
697,Melissa Henderson,ryan21@example.com,26,460,Smartphone,788.4188428410887,697,2023-07-09 20:27:04,2,1576.8376856821774,697,Price drop outside choose old take standard.,1.0
698,Candice Harvey,martinezjessica@example.org,46,502,Tablet,1173.682187413938,698,2021-07-17 21:01:26,2,2347.364374827876,698,,5.0
699,Drew Dixon,laurengallegos@example.com,56,400,Smartphone,1314.9253729827183,699,2020-12-05 16:44:58,3,3944.776118948155,699,True society if them scene. Alone never lay mention general sure and. Try gun law yourself.,
700,James Mills,tinamendez@example.com,57,600,Smartphone,705.8456853116517,700,2022-07-24 12:41:05,3,2117.537055934955,700,Mrs mother front. He center start. But vote blood body.,1.0
701,Dana Olson,oconnorrachel@example.com,53,626,Tablet,1189.1576862447378,701,2023-08-15 14:29:50,2,2378.3153724894755,701,From old success body strong. Set public hundred most. Tree work face investment.,5.0
702,Mario Hubbard,katieallen@example.org,55,92,Tablet,123.35933994203052,702,2023-09-19 04:12:11,2,246.71867988406103,702,,1.0
703,Dorothy Love,michaelward@example.org,24,973,Tablet,1405.788232066892,703,2021-11-10 10:04:55,4,5623.152928267568,703,,3.0
704,Robert Castro,tonyagregory@example.net,30,27,Laptop,1991.733120777848,704,2022-10-25 06:20:24,2,3983.466241555696,704,Soldier friend science lawyer. Every size concern group. Call act memory through one throw than.,3.0
705,Wesley Mcclain,yshort@example.org,43,752,Laptop,633.0458179949657,705,2020-06-12 10:15:12,3,1899.137453984897,705,Keep gas situation wind. Model safe than back appear country film. Compare use see.,4.0
706,Brian Michael,wbell@example.net,20,244,Tablet,630.584254279088,706,2022-03-08 03:20:15,2,1261.168508558176,706,Every wide score civil. Among understand song police role edge morning.,
707,Maurice Bell MD,alangreen@example.org,49,989,Camera,942.4732913265111,707,2022-02-27 13:07:46,1,942.4732913265111,707,,
708,Kimberly Gomez,kayladoyle@example.net,35,978,Tablet,754.1341860807111,708,2021-02-13 21:02:02,4,3016.5367443228442,708,Defense president husband usually. Our security brother realize.,1.0
709,Jordan Davenport,gainesmichelle@example.net,20,310,Laptop,230.48685045794664,709,2020-07-27 15:52:57,4,921.9474018317866,709,Understand cover age stand answer other long. Support simply table recent system.,2.0
710,Ethan Manning,victornash@example.org,31,18,Laptop,871.9651800166007,710,2023-06-30 05:15:44,1,871.9651800166007,710,Theory pay indeed public hear. Agent necessary personal. Small budget myself pressure say listen.,5.0
711,Patrick Rivera,suzannereed@example.net,21,180,Camera,1470.8177269755972,711,2021-05-03 02:28:19,2,2941.6354539511944,711,"Gun start society arm public nice thing.
Alone food return.",3.0
712,Ryan Rodriguez,virginia17@example.org,39,242,Laptop,512.8494079149101,712,2021-01-29 02:39:39,1,512.8494079149101,712,Picture sport rule house industry act goal. Interesting management debate magazine maybe.,4.0
713,Michael Thomas,phillip33@example.com,58,551,Laptop,1859.8904773337022,713,2020-08-10 17:06:47,2,3719.7809546674043,713,,4.0
714,Taylor Mcintosh,meyerkimberly@example.net,23,122,Camera,1330.5087815778568,714,2022-10-23 07:40:50,3,3991.52634473357,714,Low people management exist whom. Republican defense member.,2.0
715,Richard Charles,thomasdavid@example.com,61,52,Camera,767.1824279871371,715,2021-11-15 15:31:17,2,1534.3648559742742,715,"Trouble serious network. Scene bank small what trouble.
Production wind box clearly myself.",
716,Laura Hamilton,patrick73@example.org,31,50,Headphones,643.9170600375892,716,2021-02-19 16:39:28,3,1931.7511801127675,716,Dinner college organization cup evidence economic. Region herself local.,1.0
717,Shelby Butler,delgadocharles@example.org,42,843,Headphones,1434.0368194369996,717,2021-03-17 00:20:52,1,1434.0368194369996,717,Health central child institution. Five act shoulder generation bank.,1.0
718,Dr. Karen Rivers,paulbrady@example.com,28,362,Tablet,994.2421672368955,718,2023-06-09 12:44:27,3,2982.7265017106865,718,Yet line carry. Morning can marriage.,4.0
